book_id,title,authors,average_rating,sentiment_score,sentiment_label
544257,"Midnight Alley (The Morganville Vampires, #3)",Rachel Caine,4.11,0.0,neutral
23278537,The Little Paris Bookshop,"Nina George, Simon Pare",3.51,0.0,neutral
13562049,Sweet Tooth,Ian McEwan,3.4,0.4588,neutral
17333880,"Twisted Perfection (Rosemary Beach, #5; Perfection, #1)",Abbi Glines,4.26,0.8126,positive
19675,"Executive Orders (Jack Ryan Universe, #9)",Tom Clancy,4.04,0.0,neutral
8592946,One Thousand Gifts: A Dare to Live Fully Right Where You Are,Ann Voskamp,4.03,0.0,neutral
156427,Psycho,Robert Bloch,4.09,0.0,neutral
45100,"Ship of Magic (Liveship Traders, #1)",Robin Hobb,4.12,0.0,neutral
148337,Where Eagles Dare ,"Alistair MacLean, Clint Willis",4.12,0.0,neutral
41977,Circle of Friends,Maeve Binchy,4.0,0.4767,neutral
23513349,Milk and Honey,Rupi Kaur,4.27,0.0,neutral
5720,"Rainbow Six (Jack Ryan Universe, #10)",Tom Clancy,4.07,0.0,neutral
16788,Fragile Things: Short Fictions and Wonders,Neil Gaiman,4.02,0.0,neutral
8196732,Sister,Rosamund Lupton,3.77,0.0,neutral
20518872,"The Three-Body Problem (Remembrance of Earth’s Past, #1)","Liu Cixin, Ken Liu",4.0,-0.4019,neutral
48002,"Thief of Time (Discworld, #26; Death, #5)",Terry Pratchett,4.25,-0.8074,negative
154798,Superman: Red Son,"Mark Millar, Kilian Plunkett, Andrew Robinson, Walden Wong, Dave Johnson",4.17,0.0,neutral
227593,Three Junes,Julia Glass,3.56,0.0,neutral
52309,The Autobiography of Benjamin Franklin,"Benjamin Franklin, Lewis Leary",3.83,0.0,neutral
1858013,The Reason for God: Belief in an Age of Skepticism,Timothy J. Keller,4.2,0.0258,neutral
12891107,"King of Thorns (The Broken Empire, #2)",Mark  Lawrence,4.2,-0.4767,neutral
12160906,"The Sins of the Father (The Clifton Chronicles, #2)",Jeffrey Archer,4.01,-0.4588,neutral
187811,"Shadowland (The Mediator, #1)",Meg Cabot,4.04,0.0,neutral
3047849,"Killer (Pretty Little Liars, #6)",Sara Shepard,4.07,-0.813,negative
4898,Blue Ocean Strategy: How To Create Uncontested Market Space And Make The Competition Irrelevant,"W. Chan Kim, Renée Mauborgne",3.86,0.2732,neutral
6431790,"Fang (Maximum Ride, #6)",James Patterson,4.07,0.0,neutral
8546358,The Peach Keeper,Sarah Addison Allen,3.84,0.0,neutral
815234,The Napping House,"Audrey Wood, Don    Wood",4.27,0.0,neutral
27239265,"The Short Drop (Gibson Vaughn, #1)",Matthew FitzSimmons,4.15,-0.2732,neutral
33453,"You Suck (A Love Story, #2)",Christopher Moore,3.82,0.3182,neutral
18104607,"Beautiful Oblivion (The Maddox Brothers, #1)",Jamie McGuire,4.13,0.5994,positive
77711,"A Fire Upon the Deep (Zones of Thought, #1)",Vernor Vinge,4.13,-0.34,neutral
6709,"Practicing the Power of Now: Essential Teachings, Meditations, and Exercises from the Power of Now",Eckhart Tolle,4.25,0.0,neutral
19469,"The Face on the Milk Carton (Janie Johnson, #1)",Caroline B. Cooney,3.72,0.0,neutral
413158,Put Me in the Zoo,Robert Lopshire,4.13,0.0,neutral
6448470,"Firelight (Firelight, #1)",Sophie Jordan,3.88,0.0,neutral
9809,Invisible Cities,"Italo Calvino, William Weaver",4.19,0.0,neutral
11096647,"Flat-Out Love (Flat-Out Love, #1)",Jessica Park,4.01,0.8555,positive
17905709,The Narrow Road to the Deep North,Richard Flanagan,4.0,0.0,neutral
26582,"The Claiming of Sleeping Beauty (Sleeping Beauty, #1)","A.N. Roquelaure, Anne Rice",3.28,0.8225,positive
6114607,"The Midwife: A Memoir of Birth, Joy, and Hard Times",Jennifer Worth,4.17,0.6486,positive
10882,Hell's Angels: A Strange and Terrible Saga,Hunter S. Thompson,4.0,-0.5994,negative
9758764,Then Came You,Jennifer Weiner,3.69,0.0,neutral
395922,"The Awakening (The Vampire Diaries, #1)",L.J. Smith,3.41,0.0,neutral
73070,"It Had to Be You (Chicago Stars, #1)",Susan Elizabeth Phillips,4.04,0.0,neutral
13707738,Boomerang: Travels in the New Third World,Michael   Lewis,3.87,0.0,neutral
7227174,Fly Away Home,Jennifer Weiner,3.66,0.0,neutral
14662,The Red and the Black,"Stendhal, Roger Gard",3.87,0.0,neutral
16183,"The Virgin's Lover (The Plantagenet and Tudor Novels, #13)",Philippa Gregory,3.69,0.5859,positive
332775,"Incarceron (Incarceron, #1)",Catherine Fisher,3.64,0.0,neutral
10800916,"Awake at Dawn (Shadow Falls, #2)",C.C. Hunter,4.29,0.0,neutral
452157,The Road to the Dark Tower: Exploring Stephen King's Magnum Opus,Bev Vincent,4.29,0.0,neutral
9462795,"Starcrossed (Starcrossed, #1)",Josephine Angelini,4.08,0.0,neutral
7739934,"Night Star (The Immortals, #5)",Alyson Noel,3.82,0.0,neutral
67238,Dead Poets Society,N.H. Kleinbaum,4.21,-0.6486,negative
23745132,Wreckage,Emily Bleeker,3.66,0.0,neutral
63720,"The Fifth Elephant (Discworld, #24; City Watch, #5)",Terry Pratchett,4.24,0.0,neutral
1524173,"The Sorcerer in the North (Ranger's Apprentice, #5)",John Flanagan,4.25,0.0,neutral
639864,Autobiography of a Yogi,Paramahansa Yogananda,4.22,0.0,neutral
9595650,"Hexed (The Iron Druid Chronicles, #2)",Kevin Hearne,4.22,0.0,neutral
1325218,"Scary Stories to Tell in the Dark (Scary Stories, #1)","Alvin Schwartz, Stephen Gammell",4.05,-0.4939,neutral
26109394,Fool Me Once,Harlan Coben,3.9,-0.4404,neutral
27323,Hiroshima,John Hersey,3.94,0.0,neutral
6316171,Hate List,Jennifer Brown,4.03,-0.5719,negative
15283043,The Distance Between Us,Kasie West,3.95,0.0,neutral
3873,"A History of God: The 4,000-Year Quest of Judaism, Christianity, and Islam",Karen Armstrong,3.85,0.2732,neutral
16131032,"Abaddon's Gate (The Expanse, #3)",James S.A. Corey,4.18,0.0,neutral
5932,Twenty Love Poems and a Song of Despair,"Pablo Neruda, W.S. Merwin, Cristina García",4.33,0.4404,neutral
382549,"The Cardinal of the Kremlin (Jack Ryan Universe, #5)",Tom Clancy,4.01,0.0,neutral
1062516,"No, David!",David Shannon,4.11,-0.3595,neutral
18414,Utopia,"Thomas More, Paul Turner",3.5,0.0,neutral
1099301,"The Name of This Book Is Secret (Secret, #1)","Pseudonymous Bosch, Gilbert Ford",4.04,0.0,neutral
18053060,"Dorothy Must Die (Dorothy Must Die, #1)",Danielle  Paige,3.84,-0.8316,negative
16429,The Husband,Dean Koontz,3.8,0.0,neutral
7048800,The Particular Sadness of Lemon Cake,Aimee Bender,3.19,-0.4404,neutral
6588,"The Big Bad Wolf  (Alex Cross, #9)",James Patterson,3.97,-0.5423,negative
533465,Balzac and the Little Chinese Seamstress,"Dai Sijie, Ina Rilke",3.63,0.0,neutral
18813642,Bad Feminist,Roxane Gay,3.91,-0.5423,negative
226709,"Petals on the Wind (Dollanganger, #2)",V.C. Andrews,3.82,0.0,neutral
6690,Danny the Champion of the World,"Roald Dahl, Quentin Blake",4.07,0.5994,positive
9160695,Battle Hymn of the Tiger Mother,Amy Chua,3.61,-0.3818,neutral
19351043,Nimona,Noelle Stevenson,4.2,0.0,neutral
1192,Everyday Italian: 125 Simple and Delicious Recipes,Giada De Laurentiis,3.97,0.5719,positive
6537,"From Potter's Field (Kay Scarpetta, #6)",Patricia Cornwell,4.02,0.0,neutral
84736,"Mary, Mary (Alex Cross, #11)",James Patterson,3.93,0.0,neutral
15055,Oranges Are Not the Only Fruit,Jeanette Winterson,3.75,0.0,neutral
16139641,"Grounded (Up in the Air, #3)",R.K. Lilley,4.29,0.0,neutral
19427193,I Too Had a Love Story,Ravinder Singh,3.64,0.6369,positive
25051,"Mrs. Piggle-Wiggle (Mrs. Piggle Wiggle, #1)","Betty MacDonald, Alexandra Boiger",4.16,0.0,neutral
58962,"Trunk Music (Harry Bosch, #5; Harry Bosch Universe, #6)",Michael Connelly,4.15,0.0,neutral
18505796,"10% Happier: How I Tamed the Voice in My Head, Reduced Stress Without Losing My Edge, and Found Self-Help That Actually Works",Dan   Harris,3.93,0.4184,neutral
120230,Barefoot Contessa at Home: Everyday Recipes You'll Make Over and Over Again,"Ina Garten, Quentin Bacon",4.16,0.0,neutral
32504,"Blood Work (Harry Bosch Universe, #8; Terry McCaleb #1)",Michael Connelly,4.11,0.0,neutral
41821,The Gods Themselves,Isaac Asimov,4.08,0.0,neutral
6393047,"The Viper's Nest (39 Clues, #7)",Peter Lerangis,3.97,0.0,neutral
7742,"Ahab's Wife, or The Star-Gazer",Sena Jeter Naslund,4.02,0.0,neutral
13570,"Tsubasa: RESERVoir CHRoNiCLE, Vol. 01","CLAMP, Anthony Gerard",4.12,0.0,neutral
8962,"A Living Nightmare (Cirque Du Freak, #1)",Darren Shan,4.07,-0.4404,neutral
297627,"The League of Extraordinary Gentlemen, Vol. 1","Alan Moore, Kevin O'Neill",3.93,0.0,neutral
169756,Feed,M.T. Anderson,3.54,0.0,neutral
3819326,"Angels' Blood (Guild Hunter, #1)",Nalini Singh,4.12,0.0,neutral
752900,Medea,"Euripides, Rex Warner",3.83,0.0,neutral
6342491,"The Demon King (Seven Realms, #1)",Cinda Williams Chima,4.2,0.0,neutral
821056,Hinds' Feet on High Places,Hannah Hurnard,4.3,0.0,neutral
38333,Black Hole,Charles Burns,3.83,0.0,neutral
19358975,"Saga, Vol. 3 (Saga, #3)","Brian K. Vaughan, Fiona Staples",4.56,0.0,neutral
20263040,"Personal (Jack Reacher, #19)",Lee Child,3.9,0.0,neutral
15994634,Z: A Novel of Zelda Fitzgerald,Therese Anne Fowler,3.82,0.3182,neutral
4979,A Man Without a Country,Kurt Vonnegut Jr.,4.07,0.0,neutral
17667452,When I Found You,Catherine Ryan Hyde,3.92,0.0,neutral
25893693,Lilac Girls,Martha Hall Kelly,4.31,0.0,neutral
552894,"7th Heaven (Women's Murder Club, #7)","James Patterson, Maxine Paetro",4.06,-0.34,neutral
23664710,"Make Me (Jack Reacher, #20)",Lee Child,3.95,0.0,neutral
18428067,A Constellation of Vital Phenomena,Anthony Marra,4.13,0.296,neutral
13496738,"While It Lasts (Sea Breeze, #3)",Abbi Glines,4.24,0.0,neutral
13414676,The End of Your Life Book Club,Will Schwalbe,3.81,0.0,neutral
1672727,Two-Way Street,Lauren Barnholdt,3.8,0.0,neutral
16001443,"All In (The Blackstone Affair, #2)",Raine Miller,4.11,0.0,neutral
1814843,"The Siege of Macindaw (Ranger's Apprentice, #6)",John Flanagan,4.33,0.0,neutral
49221,A Grief Observed,C.S. Lewis,4.26,-0.4939,neutral
22416,"Transmetropolitan, Vol. 1: Back on the Street (Transmetropolitan, #1)","Warren Ellis, Darick Robertston, Garth Ennis",4.23,0.0,neutral
13833,"Emperor Mage (Immortals, #3)",Tamora Pierce,4.3,0.0,neutral
8099187,Decision Points,George W. Bush,3.77,0.0,neutral
6387565,"Witch & Wizard (Witch & Wizard, #1)","James Patterson, Gabrielle Charbonnet",3.57,-0.3612,neutral
386286,"Julie of the Wolves (Julie of the Wolves, #1)","Jean Craighead George, John Schoenherr",3.79,0.0,neutral
37743,Forever . . .,Judy Blume,3.63,0.0,neutral
22609391,The Wright Brothers,David McCullough,4.16,0.0,neutral
31231,The Matarese Circle (Matarese #1),Robert Ludlum,4.03,0.0,neutral
3147367,American Lion: Andrew Jackson in the White House,Jon Meacham,3.76,0.0,neutral
15842230,"The Forgotten (John Puller, #2)",David Baldacci,4.07,-0.2263,neutral
16065004,"Shadows of Self (Mistborn, #5)",Brandon Sanderson,4.3,0.0,neutral
17262155,"Mad About the Boy (Bridget Jones, #3)",Helen Fielding,3.32,-0.4939,neutral
30633,The Four Loves,C.S. Lewis,4.16,0.5719,positive
20639274,Archer's Voice,Mia Sheridan,4.45,-0.296,neutral
11010251,The Lost Wife,Alyson Richman,4.2,-0.3182,neutral
10505,History of Beauty,"Umberto Eco, Girolamo De Michele, Alastair McEwen",3.77,0.5859,positive
18765,"I, Claudius (Claudius, #1)",Robert Graves,4.27,-0.296,neutral
13326831,"The Testing (The Testing, #1)",Joelle Charbonneau,4.05,0.0,neutral
17908462,"Takedown Twenty (Stephanie Plum, #20)",Janet Evanovich,3.75,0.0,neutral
13628209,The Boy Who Sneaks in My Bedroom Window,Kirsty Moseley,3.95,0.0,neutral
13829,"Terrier (Beka Cooper, #1)",Tamora Pierce,4.16,0.0,neutral
8788554,"First Grave on the Right (Charley Davidson, #1)",Darynda Jones,4.07,-0.3818,neutral
18039963,A House in the Sky,"Amanda Lindhout, Sara Corbett",4.2,0.0,neutral
9615347,Anya's Ghost,Vera Brosgol,3.88,-0.3182,neutral
9912,The Rules of Attraction,Bret Easton Ellis,3.71,0.4588,neutral
30262,"The Good, the Bad, and the Undead (The Hollows, #2)",Kim Harrison,4.26,-0.1531,neutral
66693,"The Crystal Shard (Forgotten Realms: Icewind Dale, #1; Legend of Drizzt, #4)",R.A. Salvatore,4.13,0.0,neutral
44597,Wide Sargasso Sea,Jean Rhys,3.56,0.0,neutral
16286,The Magus,John Fowles,4.04,0.0,neutral
189811,"King of the Murgos (The Malloreon, #2)",David Eddings,4.1,0.0,neutral
402014,"On the Bright Side, I'm Now the Girlfriend of a Sex God (Confessions of Georgia Nicolson, #2)",Louise Rennison,3.96,0.6124,positive
20821614,"You (You, #1)",Caroline Kepnes,3.83,0.0,neutral
13618440,"Dreams of Gods & Monsters (Daughter of Smoke & Bone, #3)",Laini Taylor,4.23,0.4019,neutral
1205297,Playing for Pizza,John Grisham,3.41,0.2023,neutral
9284655,"Tiger's Curse (The Tiger Saga, #1)",Colleen Houck,4.07,-0.5423,negative
105,Chapterhouse: Dune (Dune Chronicles #6),Frank Herbert,3.89,0.0,neutral
20821284,Brown Girl Dreaming,Jacqueline Woodson,4.11,0.0,neutral
7094569,"Feed (Newsflesh Trilogy, #1)",Mira Grant,3.86,0.3612,neutral
3476,Icy Sparks,Gwyn Hyman Rubio,3.68,0.0,neutral
77394,"Anne's House of Dreams (Anne of Green Gables, #5)",L.M. Montgomery,4.12,0.4019,neutral
75024,"The Templar Legacy (Cotton Malone, #1)",Steve Berry,3.81,0.0,neutral
89165,"J is for Judgment (Kinsey Millhone, #10)",Sue Grafton,4.01,0.0,neutral
4836308,The Physick Book of Deliverance Dane,Katherine Howe,3.7,0.0,neutral
55401,"Deadhouse Gates (The Malazan Book of the Fallen, #2)",Steven Erikson,4.25,-0.3612,neutral
17983690,"Lick (Stage Dive, #1)",Kylie Scott,4.15,0.0,neutral
78982,"Not a Penny More, Not a Penny Less",Jeffrey Archer,4.0,0.0,neutral
2315892,Best Served Cold,Joe Abercrombie,4.16,0.6369,positive
18635113,Elizabeth Is Missing,Emma Healey,3.7,-0.296,neutral
154424,"Consent to Kill (Mitch Rapp, #8)",Vince Flynn,4.36,-0.5859,negative
8171378,The Warmth of Other Suns: The Epic Story of America's Great Migration,Isabel Wilkerson,4.31,0.7964,positive
20706317,The First Fifteen Lives of Harry August,Claire North,4.04,0.0,neutral
13623012,"The Prisoner of Heaven (The Cemetery of Forgotten Books, #3)",Carlos Ruiz Zafón,3.96,-0.2732,neutral
11366,The Guns of August,"Barbara W. Tuchman, Robert K. Massie",4.18,0.0,neutral
937249,"Separation of Power (Mitch Rapp, #5)",Vince Flynn,4.32,0.0,neutral
71865,"Tomorrow, When the War Began (Tomorrow, #1)",John Marsden,4.05,-0.5994,negative
6514074,"The Monuments Men: Allied Heroes, Nazi Thieves, and the Greatest Treasure Hunt in History","Robert M. Edsel, Bret Witter",3.75,0.7506,positive
18140047,Love Letters to the Dead,Ava Dellaira,3.82,-0.0258,neutral
10776793,War Brides,Helen Bryan,3.75,-0.5994,negative
27071490,Homegoing,Yaa Gyasi,4.41,0.0,neutral
7237456,Packing for Mars: The Curious Science of Life in the Void,Mary Roach,3.93,0.3182,neutral
3410425,"Divine Justice (Camel Club, #4)",David Baldacci,4.17,0.7906,positive
3918010,"Kick-Ass (Kick-Ass, #1)","Mark Millar, John Romita Jr., Rob Liefeld",4.04,-0.5574,negative
408615,Left to Tell: Discovering God Amidst the Rwandan Holocaust,"Immaculée Ilibagiza, Steve Erwin",4.43,0.2732,neutral
6686101,"Plague (Gone, #4)",Michael  Grant,4.18,0.3612,neutral
5344,Hard Times,Charles Dickens,3.5,-0.1027,neutral
16033842,La Vérité sur l'affaire Harry Quebert,Joël Dicker,3.94,0.0,neutral
3722183,A God in Ruins,Kate Atkinson,3.92,-0.2023,neutral
6681454,Caught,Harlan Coben,3.98,0.0,neutral
46202,"Magic Study (Study, #2)",Maria V. Snyder,4.06,0.0,neutral
667985,"Chobits, Vol. 1","CLAMP, Shirley Kubo",4.05,0.0,neutral
57891,Battle Royale,"Koushun Takami, Yuji Oniki",4.24,-0.3818,neutral
5126859,The Girl Who Chased the Moon,Sarah Addison Allen,3.97,0.0,neutral
107301,A Town Like Alice,Nevil Shute,4.12,0.3612,neutral
18667945,#GIRLBOSS,Sophia Amoruso,3.71,0.0,neutral
2485785,The Secret Life of CeeCee Wilkes,Diane Chamberlain,4.09,0.0,neutral
188230,Crocodile on the Sandbank (Amelia Peabody #1),Elizabeth Peters,4.02,0.0,neutral
6070950,"Bed of Roses (Bride Quartet, #2)",Nora Roberts,4.11,0.0,neutral
19670,"Debt of Honor (Jack Ryan Universe, #8)",Tom Clancy,4.03,0.1779,neutral
17343,Till We Have Faces,C.S. Lewis,4.19,0.0,neutral
224500,"Point Blank (Alex Rider, #2)",Anthony Horowitz,4.1,0.0,neutral
15676,Strangers,Dean Koontz,3.98,0.0,neutral
93794,"The Kill Artist (Gabriel Allon, #1)",Daniel Silva,4.0,-0.6908,negative
490867,"Knuffle Bunny: A Cautionary Tale (Knuffle Bunny, #1)",Mo Willems,4.26,0.0,neutral
47558,"The Gashlycrumb Tinies (The Vinegar Works, #1)",Edward Gorey,4.23,0.0,neutral
13147230,"The Long Earth (The Long Earth, #1)","Terry Pratchett, Stephen Baxter",3.74,0.0,neutral
1319,The War of Art: Break Through the Blocks & Win Your Inner Creative Battles,"Steven Pressfield, Robert McKee",4.07,-0.1779,neutral
13223520,"Existence (Existence Trilogy, #1)",Abbi Glines,3.95,0.0,neutral
11438,What We Talk About When We Talk About Love,Raymond Carver,4.22,0.6369,positive
104379,That Summer,Sarah Dessen,3.49,0.0,neutral
10790290,"Theft of Swords (The Riyria Revelations, #1-2)",Michael J. Sullivan,4.21,0.0,neutral
17286747,"Necessary Lies (Necessary Lies, #1)",Diane Chamberlain,4.21,-0.6808,negative
218467,Lucifer's Hammer,"Larry Niven, Jerry Pournelle",3.98,0.0,neutral
114144,Montana Sky,Nora Roberts,4.07,0.0,neutral
31548,Of Human Bondage,"W. Somerset Maugham, Benjamin DeMott, Maeve Binchy",4.11,0.0,neutral
18879761,I Was Here,Gayle Forman,3.78,0.0,neutral
99110,"The Complete Tales and Poems of Winnie-the-Pooh (Winnie-the-Pooh, #1-4)","A.A. Milne, Ernest H. Shepard",4.49,0.0,neutral
32527,"Alone (Detective D.D. Warren, #1)",Lisa Gardner,3.97,-0.25,neutral
153542,Mike Mulligan and His Steam Shovel,Virginia Lee Burton,4.2,0.0,neutral
17383994,"Divergent Series Complete Box Set (Divergent, #1-3)",Veronica Roth,4.32,0.0,neutral
116296,"Making Money (Discworld, #36; Moist Von Lipwig, #2)",Terry Pratchett,4.23,0.0,neutral
7074000,"Happy Ever After (Bride Quartet, #4)",Nora Roberts,4.17,0.5719,positive
10908,Harvesting the Heart,Jodi Picoult,3.59,0.0,neutral
16150830,"Never Fade (The Darkest Minds, #2)",Alexandra Bracken,4.33,0.3875,neutral
3257136,Dewey: The Small-Town Library Cat Who Touched the World,"Vicki Myron, Bret Witter",3.85,0.0,neutral
16248113,"The School for Good and Evil (The School for Good and Evil, #1)",Soman Chainani,4.0,-0.6124,negative
30259,"For a Few Demons More (The Hollows, #5)",Kim Harrison,4.33,0.0,neutral
20821043,"The Secret Place (Dublin Murder Squad, #5)",Tana French,3.83,-0.6908,negative
6604209,"Mistborn Trilogy Boxed Set (Mistborn, #1-3)",Brandon Sanderson,4.55,0.0,neutral
227729,"The Coffin Dancer (Lincoln Rhyme, #2)",Jeffery Deaver,4.16,0.0,neutral
6545536,"The Emperor's Code (The 39 Clues, #8)",Gordon Korman,4.04,0.0,neutral
808853,The Complete Adventures of Curious George,"Margret Rey, H.A. Rey",4.23,0.5719,positive
11082037,"The Drop (Harry Bosch, #17; Harry Bosch Universe, #21)",Michael Connelly,4.14,-0.2732,neutral
500503,"Sailor Moon, #1 (Sailor Moon, #1)",Naoko Takeuchi,4.29,0.0,neutral
17331349,Think Like a Freak,"Steven D. Levitt, Stephen J. Dubner",3.82,-0.1027,neutral
13436373,Drama,"Raina Telgemeier, Gurihiru",4.14,0.0,neutral
3110,Assassination Vacation,Sarah Vowell,3.98,-0.5994,negative
92121,Nine Princes in Amber (The Chronicles of Amber #1),Roger Zelazny,4.1,0.0,neutral
18144053,The Museum of Extraordinary Things,Alice Hoffman,3.73,0.0,neutral
3220405,"Ender in Exile (Ender's Saga, #1.2)",Orson Scott Card,3.89,0.0,neutral
421129,"Undead and Unwed (Undead, #1)",MaryJanice Davidson,3.81,0.0,neutral
4005,The Fifth Mountain,Paulo Coelho,3.61,0.0,neutral
35519,The Power of Myth,"Joseph Campbell, Bill Moyers",4.3,0.0,neutral
21418013,"Lock In (Lock In, #1)",John Scalzi,3.85,0.0,neutral
17380041,Longbourn,Jo Baker,3.62,0.0,neutral
21412202,As You Wish: Inconceivable Tales from the Making of The Princess Bride,"Cary Elwes, Joe Layden, Various, Rob Reiner",4.08,-0.2263,neutral
773276,"Good Night, Gorilla",Peggy Rathmann,4.2,0.4404,neutral
13522285,The Beginning of Everything,Robyn Schneider,3.78,0.0,neutral
6389704,"In Too Deep (The 39 Clues, #6)",Jude Watson,4.02,0.0,neutral
138269,Catch Me If You Can: The True Story of a Real Fake,"Frank W. Abagnale, Stan Redding",4.05,-0.0772,neutral
30248,"Narcissus in Chains (Anita Blake, Vampire Hunter, #10)",Laurell K. Hamilton,3.89,0.0,neutral
119760,The Seat of the Soul,Gary Zukav,3.97,0.0,neutral
16099159,"Claim Me (Stark Trilogy, #2)",J. Kenner,4.21,0.0,neutral
3483,Special Topics in Calamity Physics,Marisha Pessl,3.7,0.4019,neutral
18498558,Bird Box,Josh Malerman,3.98,0.0,neutral
12476820,"Partials (Partials Sequence, #1)",Dan Wells,3.94,0.25,neutral
72223,The Worst Hard Time: The Untold Story of Those Who Survived the Great American Dust Bowl,Timothy Egan,4.04,0.4404,neutral
17802747,What She Left Behind,Ellen Marie Wiseman,3.86,0.0,neutral
3047850,"Wicked (Pretty Little Liars, #5)",Sara Shepard,4.04,-0.7584,negative
184655,"Transfer of Power (Mitch Rapp, #3)",Vince Flynn,4.31,0.0,neutral
395090,Ariel,Sylvia Plath,4.23,0.0,neutral
13223349,"Batman, Volume 1: The Court of Owls","Scott Snyder, Greg Capullo, Jonathan Glapion",4.3,0.0,neutral
33457,"Practical Demonkeeping (Pine Cove, #1)",Christopher Moore,3.81,0.0,neutral
46438,"The Last Templar (Templar, #1)",Raymond Khoury,3.57,0.0,neutral
6534932,Official Book Club Selection: A Memoir According to Kathy Griffin,Kathy Griffin,3.8,0.0,neutral
240976,The Book of Laughter and Forgetting,"Milan Kundera, Aaron Asher",4.01,0.4939,neutral
479415,The Horse Whisperer,Nicholas Evans,3.77,0.0,neutral
46191,Why Men Love Bitches: From Doormat to Dreamgirl—A Woman's Guide to Holding Her Own in a Relationship,Sherry Argov,3.89,0.0772,neutral
3047851,"Wanted (Pretty Little Liars, #8)",Sara Shepard,4.15,-0.4779,neutral
1225621,"The Outlaw Demon Wails (The Hollows, #6)",Kim Harrison,4.38,0.0,neutral
433567,Flatland: A Romance of Many Dimensions,"Edwin A. Abbott, Banesh Hoffmann",3.81,0.5574,positive
7728889,"The Diviners (The Diviners, #1)",Libba Bray,3.96,0.5267,positive
3798703,The Spectacular Now,Tim Tharp,3.53,0.0,neutral
14142,The Art of Loving,"Erich Fromm, Peter D. Kramer, Rainer Funk",4.01,0.5994,positive
537070,"Gregor and the Code of Claw (Underland Chronicles, #5)",Suzanne Collins,4.25,0.0,neutral
64218,"Eric (Discworld, #9; Rincewind #4)",Terry Pratchett,3.72,0.0,neutral
25102,A Game of You (The Sandman #5),"Neil Gaiman, Shawn McManus, Colleen Doran, Bryan Talbot, George Pratt, Stan Woch, Dick Giordano, Todd Klein",4.43,-0.5106,negative
9302,The Other Side of the Story,Marian Keyes,3.77,0.0,neutral
16729,Beach Music,Pat Conroy,4.13,0.0,neutral
46601,"An Echo in the Darkness (Mark of the Lion, #2)",Francine Rivers,4.6,-0.25,neutral
16429619,"The Kiss of Deception (The Remnant Chronicles, #1)",Mary E. Pearson,4.06,-0.0258,neutral
42933,"Tai-Pan (Asian Saga, #2)",James Clavell,4.25,0.0,neutral
8573020,The Weird Sisters,Eleanor Brown,3.36,-0.1779,neutral
34498,"The Truth (Discworld, #25; Industrial Revolution, #2)",Terry Pratchett,4.25,0.3182,neutral
10762469,The Leftovers,Tom Perrotta,3.38,0.0,neutral
66354,Flow: The Psychology of Optimal Experience,Mihaly Csikszentmihalyi,4.1,0.3612,neutral
23454,"Dragons of Winter Night (Dragonlance: Chronicles, #2)","Margaret Weis, Tracy Hickman",4.13,0.0,neutral
9219901,Unbearable Lightness: A Story of Loss and Gain,Portia de Rossi,3.83,0.2732,neutral
693016,"Mine Till Midnight (The Hathaways, #1)",Lisa Kleypas,4.08,0.0,neutral
96123,All the President's Men,"Carl Bernstein, Bob Woodward",4.17,0.0,neutral
7263429,Wolfsbane (Nightshade #2; Nightshade World #5),Andrea Cremer,4.12,0.0,neutral
20564,The Mill on the Floss,"George Eliot, A.S. Byatt",3.77,0.0,neutral
7334201,Super Sad True Love Story,Gary Shteyngart,3.44,0.8316,positive
407813,"The Blue Sword (Damar, #1)",Robin McKinley,4.24,0.0,neutral
13570854,"Lover at Last (Black Dagger Brotherhood, #11)",J.R. Ward,4.3,0.5859,positive
10661081,Vampire Academy: The Ultimate Guide (Vampire Academy),"Michelle Rowen, Richelle Mead",4.45,0.0,neutral
121732,Surprised by Joy: The Shape of My Early Life,C.S. Lewis,4.14,0.6908,positive
24113,"Gödel, Escher, Bach: An Eternal Golden Braid",Douglas R. Hofstadter,4.3,0.0,neutral
153780,"Trickster's Queen (Daughter of the Lioness, #2)",Tamora Pierce,4.28,0.0,neutral
95819,"The Poetry of Robert Frost (Collected Poems, Complete & Unabridged)","Robert Frost, Edward Connery Lathem",4.23,0.0,neutral
8953,"Freak the Mighty (Freak The Mighty, #1)",Rodman Philbrick,3.98,-0.4404,neutral
15790873,"This Is What Happy Looks Like (This is What Happy Looks Like, #1)",Jennifer E. Smith,3.69,0.9081,positive
53817,What's So Amazing About Grace?,Philip Yancey,4.21,0.7996,positive
10816297,"Kill Shot (Mitch Rapp, #2)",Vince Flynn,4.3,-0.6908,negative
74389,"The Plains of Passage (Earth's Children, #4)",Jean M. Auel,3.77,0.0,neutral
17733898,"Hard Luck (Diary of a Wimpy Kid, #8)",Jeff Kinney,4.28,0.1779,neutral
9838,The Bookseller of Kabul,"Åsne Seierstad, Ingrid Christopherson",3.76,0.0,neutral
833710,"The Merchant of Death (Pendragon, #1)",D.J. MacHale,3.93,-0.5994,negative
4703581,The City & the City,China Miéville,3.91,0.0,neutral
128759,"Fatal Voyage (Temperance Brennan, #4)",Kathy Reichs,4.04,-0.5423,negative
4345498,"Magic Strikes (Kate Daniels, #3)",Ilona Andrews,4.44,-0.3612,neutral
15748898,"My Favorite Mistake (My Favorite Mistake, #1)",Chelsea M. Cameron,4.01,0.296,neutral
124918,Airport,Arthur Hailey,3.92,0.0,neutral
7201913,"Angel (Maximum Ride, #7)",James Patterson,4.02,0.0,neutral
4983,Kurt Vonnegut's Cat's Cradle (Modern Critical Interpretations),"Harold Bloom, Terry Southern, David H. Goldsmith, James Lundquist, Lawrence R. Broer, Peter J. Reed, Loree Rackstraw, William S. Doxey, Jerome Klinkowitz, Richard Giannone, John L. Simons, Leonard Mustazza, Zoltan Ab di-Nagy, Peter Freese, Wendy B. Faris",4.35,-0.3182,neutral
91248,"Ramona the Brave (Ramona, #3)","Beverly Cleary, Alan Tiegreen",4.09,0.5267,positive
216422,The Last Command,Timothy Zahn,4.2,0.0,neutral
13578175,The Emperor's Soul,Brandon Sanderson,4.33,0.0,neutral
2906039,Just After Sunset,Stephen King,3.85,0.0,neutral
201114,Sold,Patricia McCormick,4.19,0.0,neutral
552887,"Double Cross (Alex Cross, #13)",James Patterson,3.99,0.0,neutral
27822,Eugene Onegin,"Alexander Pushkin, James E. Falen",4.08,0.0,neutral
13138635,"These Broken Stars (Starbound, #1)","Amie Kaufman, Meagan Spooner",3.93,-0.4767,neutral
2986865,"Eon: Dragoneye Reborn (Eon, #1)",Alison Goodman,3.98,0.0,neutral
