book_id,title,authors,average_rating,sentiment_score,sentiment_label
76661,"Being a Green Mother (Incarnations of Immortality, #5)",Piers Anthony,3.95,0.0,neutral
3334563,"The Inkheart Trilogy: Inkheart, Inkspell, Inkdeath (Inkworld, #1-3)",Cornelia Funke,4.17,0.0,neutral
537094,The Overcoat,Nikolai Gogol,4.12,0.0,neutral
102030,Musashi,"Eiji Yoshikawa, Charles Terry, Edwin O. Reischauer",4.43,0.0,neutral
6696465,"Finally (Willow Falls, #2)",Wendy Mass,4.19,0.0,neutral
6398972,Ford County,John Grisham,3.56,0.0,neutral
93157,The Monk,Matthew      Lewis,3.8,0.0,neutral
23281640,"Gathering Prey (Lucas Davenport, #25)",John Sandford,4.18,0.0,neutral
17232261,Songs of Willow Frost,Jamie Ford,3.64,0.0,neutral
280366,"Jar City (Inspector Erlendur, #3)","Arnaldur Indriðason, Bernard Scudder",3.8,0.0,neutral
28568,"The Vanished Man (Lincoln Rhyme, #5)",Jeffery Deaver,4.08,0.0,neutral
12926804,One for the Murphys,Lynda Mullaly Hunt,4.31,0.0,neutral
324737,"Fresh Wind, Fresh Fire: What Happens When God's Spirit Invades the Heart of His People","Jim Cymbala, Dean Merrill",4.24,0.4404,neutral
12291438,"The Madman’s Daughter (The Madman’s Daughter, #1)",Megan Shepherd,3.69,0.0,neutral
16131072,"Second Honeymoon (Honeymoon, #2)","James Patterson, Howard Roughan",3.89,0.0,neutral
23355069,"Hero (Hero, #1)",Samantha Young,4.1,0.5574,positive
55352,Brain Droppings,George Carlin,4.11,0.0,neutral
8696,Last Chance to See,"Douglas Adams, Mark Carwardine",4.33,0.25,neutral
1653655,"Swindle (Swindle, #1)",Gordon Korman,3.94,-0.5267,negative
15786110,Relish: My Life in the Kitchen,Lucy Knisley,3.89,0.0,neutral
15832932,What I Thought Was True,Huntley Fitzpatrick,3.71,0.4215,neutral
9528186,Pretty Little Liars (TV Series),Lambert M. Surhone,4.46,0.024,neutral
10429037,"Ruthless (Pretty Little Liars, #10)",Sara Shepard,3.93,-0.4779,neutral
18667976,The Secret Life of Violet Grant,Beatriz Williams,3.97,0.3612,neutral
37338,"Wicked Ties (Wicked Lovers, #1)",Shayla Black,3.97,0.0,neutral
47878,"Charlie Bone and the Beast (The Children of the Red King, #6)",Jenny Nimmo,3.93,0.0,neutral
27406436,The Baller: A Down and Dirty Football Novel,Vi Keeland,4.13,-0.1531,neutral
22055280,"The Providence of Fire (Chronicle of the Unhewn Throne, #2)",Brian Staveley,4.16,-0.34,neutral
51985,Existentialism Is a Humanism,"Jean-Paul Sartre, Arlette Elkaïm-Sartre, Annie Cohen-Solal, Carol Macomber",3.96,0.0,neutral
15451058,My Life on the Road,Gloria Steinem,4.08,0.0,neutral
7696135,Making Ideas Happen: Overcoming the Obstacles Between Vision and Reality,Scott Belsky,3.94,-0.1531,neutral
6609864,"Sweet Little Lies (L.A. Candy, #2)",Lauren Conrad,3.53,0.1263,neutral
17830559,"Remy (Real, #3)",Katy Evans,4.31,0.0,neutral
11227043,"Rock Chick Revenge (Rock Chick, #5)",Kristen Ashley,4.5,-0.5267,negative
342994,The Little Match Girl,"Hans Christian Andersen, Rachel Isadora",4.08,0.0,neutral
95643,The Places in Between,Rory Stewart,3.88,0.0,neutral
24611454,"Stars of Fortune (The Guardians Trilogy, #1)",Nora Roberts,4.0,0.0,neutral
13425393,I Suck at Girls,Justin Halpern,3.79,-0.4404,neutral
16342,"Cat Among the Pigeons (Hercule Poirot, #32)",Agatha Christie,3.82,0.0,neutral
15786792,Paris,Edward Rutherfurd,3.95,0.0,neutral
77995,The Necklace and Other Short Stories,Guy de Maupassant,3.94,0.0,neutral
84786,Void Moon,Michael Connelly,3.95,0.0,neutral
34057,Captains Courageous,Rudyard Kipling,3.88,0.5267,positive
168571,"Shadow Prey (Lucas Davenport, #2)",John Sandford,3.99,0.0,neutral
31333,Violin,Anne Rice,3.26,0.0,neutral
25527908,The Forgetting Time,Sharon Guskin,3.79,0.0,neutral
809849,Dear Zoo: A Lift-the-Flap Book,Rod Campbell,4.25,0.3818,neutral
13618,"Death Note, Vol. 3: Hard Run (Death Note, #3)","Tsugumi Ohba, Takeshi Obata",4.42,-0.6486,negative
11309018,"The Lost Stories (Ranger's Apprentice, #11)",John Flanagan,4.27,-0.3182,neutral
15738951,"Deep Down (Jack Reacher, #16.5)",Lee Child,3.87,0.0,neutral
10947600,Saving June,Hannah Harrington,3.97,0.0,neutral
23398806,"Eeny Meeny (Helen Grace, #1)",M.J. Arlidge,3.88,0.4215,neutral
15513156,"Of Triton (The Syrena Legacy, #2)",Anna Banks,4.0,0.0,neutral
7830126,What the Night Knows,Dean Koontz,3.74,0.0,neutral
16174197,"Knight & Play (Knight, #1)",Kitty French,4.04,0.34,neutral
18405221,"Queen of Fire (Raven's Shadow, #3)",Anthony  Ryan,3.64,-0.34,neutral
404223,"The Wounded Land (The Second Chronicles of Thomas Covenant, #1)",Stephen R. Donaldson,3.96,0.0,neutral
249042,Darkness Visible: A Memoir of Madness,William Styron,4.04,-0.5994,negative
13057939,In the Shadow of the Banyan,Vaddey Ratner,4.04,0.0,neutral
9858488,Dead End in Norvelt,Jack Gantos,3.72,-0.6486,negative
6611038,"Spider's Bite (Elemental Assassin, #1)",Jennifer Estep,3.87,0.0,neutral
123845,Self-Reliance and Other Essays,Ralph Waldo Emerson,4.14,0.0,neutral
70241,Crash,J.G. Ballard,3.58,-0.4019,neutral
769016,How to Talk So Kids Will Listen & Listen So Kids Will Talk,"Adele Faber, Elaine Mazlish, Kimberly Ann Coe",4.24,0.0,neutral
294951,Fiddler on the Roof,"Joseph Stein, Jerry Bock, Sheldon Harnick",4.2,0.0,neutral
17607848,"Afterburn (Jax & Gia, #1)",Sylvia Day,3.97,0.0,neutral
7926,"All-of-a-Kind Family (All-of-a-Kind Family, #1)",Sydney Taylor,4.23,0.0,neutral
18114057,Influx,Daniel Suarez,3.91,0.0,neutral
15560,"Ilse Witch (Voyage of the Jerle Shannara, #1)",Terry Brooks,3.95,-0.3612,neutral
95420,Personal History,Katharine Graham,4.13,0.0,neutral
27824826,"The Dry (Aaron Falk, #1)",Jane Harper,4.07,0.0,neutral
40320,Full House (Full #1),"Janet Evanovich, Charlotte Hughes",3.63,0.0,neutral
291,The Broken Wings,"Kahlil Gibran, Anthony R. Ferris",3.93,-0.4767,neutral
14889780,"Two Graves (Pendergast, #12)","Douglas Preston, Lincoln Child",4.03,-0.296,neutral
13109291,"Blood of Dragons (Rain Wild Chronicles, #4)",Robin Hobb,4.12,0.0,neutral
539904,A Bridge Too Far,Cornelius Ryan,4.24,0.0,neutral
87220,Loser,Jerry Spinelli,3.72,-0.5267,negative
498835,"Sepulchre (Languedoc, #2)",Kate Mosse,3.73,0.0,neutral
7778609,"Kill the Dead (Sandman Slim, #2)",Richard Kadrey,4.06,-0.875,negative
100247,Vagabonding: An Uncommon Guide to the Art of Long-Term World Travel,Rolf Potts,3.92,0.0,neutral
12383252,"Kiss the Dead (Anita Blake, Vampire Hunter #21)",Laurell K. Hamilton,3.79,-0.3612,neutral
10775,The Garden of Eden,Ernest Hemingway,3.74,0.0,neutral
1333030,"Sweet Surrender (Sweet, #1)",Maya Banks,3.99,0.4588,neutral
22875,"The One Tree (The Second Chronicles of Thomas Covenant, #2)",Stephen R. Donaldson,3.96,0.0,neutral
24816,Homicidal Psycho Jungle Cat: A Calvin and Hobbes Collection,Bill Watterson,4.71,0.0,neutral
17190226,"Surrender Your Love (Surrender Your Love, #1)",J.C. Reed,3.91,0.8555,positive
17985262,CyberStorm,Matthew Mather,3.75,0.0,neutral
24476,Fargo Rock City: A Heavy Metal Odyssey in Rural North Dakota,Chuck Klosterman,3.8,0.0,neutral
795034,"To Green Angel Tower, Part 1 (Memory, Sorrow, and Thorn, #3; Part 1)",Tad Williams,4.18,-0.5267,negative
6818019,"I Am Nujood, Age 10 and Divorced","Nujood Ali, Delphine Minoui, Linda Coverdale",3.79,0.0,neutral
43798,The Feast of All Saints,Anne Rice,3.83,0.0,neutral
18453074,To Rise Again at a Decent Hour,Joshua Ferris,3.08,0.0,neutral
150720,Proof,David Auburn,4.01,0.0,neutral
121581,"The Past Through Tomorrow (Future History, #1-21)","Robert A. Heinlein, Damon Knight",4.15,0.0,neutral
86525,"Master of the Senate (The Years of Lyndon Johnson, #3)",Robert A. Caro,4.41,0.0,neutral
15722284,"Saint Odd (Odd Thomas, #7)",Dean Koontz,4.12,-0.3182,neutral
6671,The Wonderful Story of Henry Sugar and Six More,Roald Dahl,4.15,0.5719,positive
140091,"Real Murders (Aurora Teagarden, #1)",Charlaine Harris,3.66,-0.6124,negative
7926242,"Port Mortuary (Kay Scarpetta, #18)",Patricia Cornwell,3.55,0.0,neutral
672948,Arch of Triumph: A Novel of a Man Without a Country,Erich Maria Remarque,4.4,0.6597,positive
154795,The Death of Superman,"Dan Jurgens, Jerry Ordway, Louise Simonson, Roger Stern, Jon Bogdanove, Tom Grummett, Jackson Butch Guice, Brett Breeding, Rick Burchett, Doug Hazlewood, Dennis Janke, Denis Rodier",3.89,-0.5994,negative
144800,The Raw Shark Texts,Steven Hall,3.87,0.0,neutral
27904311,"The Hammer of Thor (Magnus Chase and the Gods of Asgard, #2)",Rick Riordan,4.37,0.0,neutral
15771862,Wave,Sonali Deraniyagala,3.7,0.0,neutral
1307,"Fire Sea (The Death Gate Cycle, #3)","Margaret Weis, Tracy Hickman",4.05,-0.743,negative
13547504,"Far from the Tree: Parents, Children, and the Search for Identity",Andrew Solomon,4.26,0.0,neutral
958277,"Junie B. Jones and the  Stupid Smelly Bus (Junie B. Jones, #1)","Barbara Park, Denise Brunkus",3.9,-0.5267,negative
23887,The Autumn of the Patriarch,"Gabriel García Márquez, Gregory Rabassa",3.84,0.0,neutral
3276637,"Bones of the Hills (Conqueror, #3)",Conn Iggulden,4.32,0.0,neutral
13330771,Hallucinations,Oliver Sacks,3.85,0.0,neutral
12444297,"Burned (Fever, #7)",Karen Marie Moning,4.12,0.0,neutral
3301759,The Murders in the Rue Morgue,Edgar Allan Poe,3.92,-0.6124,negative
104086,The Summer Tree (The Fionavar Tapestry #1),Guy Gavriel Kay,3.99,0.0,neutral
7909,"Betsy-Tacy (Betsy-Tacy, #1)","Maud Hart Lovelace, Lois Lenski",4.07,0.0,neutral
2020935,Sweethearts,Sara Zarr,3.64,0.5859,positive
1474628,The Monsters of Templeton,Lauren Groff,3.58,0.0,neutral
18107951,"Midnight Crossroad (Midnight, Texas, #1)",Charlaine Harris,3.63,0.0,neutral
269746,"Catering to Nobody (A Goldy Bear Culinary Mystery, #1)",Diane Mott Davidson,3.85,0.0,neutral
12614410,"The Lost Prince (The Iron Fey: Call of the Forgotten, #1)",Julie Kagawa,4.05,-0.4939,neutral
2095583,"Devil Bones (Temperance Brennan, #11)",Kathy Reichs,3.89,-0.6597,negative
116114,From Here to Eternity,James  Jones,4.09,0.0,neutral
389763,Change Your Thoughts - Change Your Life: Living the Wisdom of the Tao,Wayne W. Dyer,4.24,0.5267,positive
81176,"Dude, Where's My Country?",Michael Moore,3.4,0.0,neutral
364089,The Last Don,Mario Puzo,3.8,0.0,neutral
11995136,محال,"يوسف زيدان, Youssef Ziedan",3.31,0.0,neutral
19452,"Ready or Not (All-American Girl, #2)",Meg Cabot,3.4,0.3612,neutral
128755,"Cross Bones (Temperance Brennan, #8)",Kathy Reichs,3.86,0.0,neutral
163363,All But My Life: A Memoir,Gerda Weissmann Klein,4.28,0.0,neutral
577542,Rikki-Tikki-Tavi,"Rudyard Kipling, Jerry Pinkney",3.96,0.0,neutral
2249196,"All-Star Superman, Vol. 2","Grant Morrison, Frank Quitely",4.33,0.3612,neutral
17345242,The World of Ice & Fire: The Untold History of Westeros and the Game of Thrones,"George R.R. Martin, Elio M. García Jr., Linda Antonsson",4.25,-0.34,neutral
110386,"To Sir Phillip, With Love (Bridgertons, #5)",Julia Quinn,3.89,0.6369,positive
454236,Miracle in the Andes,"Nando Parrado, Vince Rause",4.21,0.5859,positive
17336849,"Lost & Found (Lost & Found, #1)",Nicole  Williams,4.13,-0.3182,neutral
298730,"Among the Barons (Shadow Children, #4)",Margaret Peterson Haddix,4.08,0.0,neutral
20912424,The War that Saved My Life (The War That Saved My Life #1),"Kimberly Brubaker Bradley, مرضیه ورشوساز",4.43,-0.4939,neutral
125662,"Say Cheese and Die! (Goosebumps, #4)",R.L. Stine,3.72,-0.636,negative
328907,"Sharpe's Tiger (Sharpe, #1)",Bernard Cornwell,4.08,0.0,neutral
207684,Jinx,Meg Cabot,3.72,0.0,neutral
53064,Death in Venice and Other Tales,"Thomas Mann, Joachim Neugroschel",3.87,-0.5994,negative
21874813,"As Chimney Sweepers Come to Dust (Flavia de Luce, #7)",Alan Bradley,3.94,0.0,neutral
13258,What Was She Thinking? [Notes on a Scandal],Zoë Heller,3.69,0.0,neutral
25293695,"The Beast (Black Dagger Brotherhood, #14)",J.R. Ward,4.45,0.0,neutral
65399,"Sullivan's Island (Lowcountry Tales, #1)",Dorothea Benton Frank,4.02,0.0,neutral
229149,"Cardcaptor Sakura: Master of the Clow, Vol. 1 (Cardcaptor Sakura, #7)","CLAMP, Anita Sengupta",4.34,0.0,neutral
10897866,"The Soulkeepers (The Soulkeepers, #1)",G.P. Ching,3.71,0.0,neutral
33820,Up Country,Nelson DeMille,3.99,0.0,neutral
1048645,Private Peaceful,Michael Morpurgo,4.16,0.4939,neutral
383514,"Her Royal Spyness (Her Royal Spyness Mysteries, #1)",Rhys Bowen,3.76,0.0,neutral
12288282,"Gunmetal Magic (Kate Daniels, #5.5)",Ilona Andrews,4.28,0.0,neutral
22381326,"Half a War (Shattered Sea, #3)",Joe Abercrombie,4.01,-0.5994,negative
10813469,"Rock Chick Renegade (Rock Chick, #4)",Kristen Ashley,4.46,0.0,neutral
15729261,"The Marriage Mistake (Marriage to a Billionaire, #3)",Jennifer Probst,3.96,-0.34,neutral
886512,Jamberry,Bruce Degen,4.17,0.0,neutral
8269450,"Darkest Powers Trilogy (Darkest Powers, #1-3)",Kelley Armstrong,4.47,-0.4939,neutral
261604,"Rhapsody: Child of Blood (Symphony of Ages, #1)",Elizabeth Haydon,3.95,0.0,neutral
91201,Doctors,Erich Segal,4.0,0.0,neutral
142395,Samarkand,"Amin Maalouf, Russell Harris",4.2,0.0,neutral
7685763,"Indulgence in Death (In Death, #31)",J.D. Robb,4.32,-0.8316,negative
15852479,We Need New Names,NoViolet Bulawayo,3.71,0.0,neutral
894072,The Little Red Caboose (Little Golden Book),Marian Potter,4.21,0.0,neutral
5093760,Pretty in Plaid,Jen Lancaster,3.88,0.4939,neutral
180930,Wicca: A Guide for the Solitary Practitioner,Scott Cunningham,4.01,0.0,neutral
179142,All My Sons,"Arthur Miller, Christopher Bigsby",3.87,0.0,neutral
7863274,Graffiti Moon,Cath Crowley,3.9,0.0,neutral
845403,Mufaro's Beautiful Daughters: An African Tale,John Steptoe,4.32,0.5994,positive
61904,"Paladin of Souls (World of the Five Gods, #2)",Lois McMaster Bujold,4.13,0.0,neutral
13589182,Mastery,Robert Greene,4.27,0.0,neutral
4986,"God Bless You, Dr. Kevorkian",Kurt Vonnegut Jr.,3.83,0.5994,positive
3090282,A Homemade Life: Stories and Recipes from My Kitchen Table,Molly Wizenberg,3.94,0.0,neutral
138069,The Three Pigs,David Wiesner,4.15,0.0,neutral
26123,Learned Optimism: How to Change Your Mind and Your Life,Martin E.P. Seligman,3.98,0.5423,positive
7827221,"Desires of the Dead (The Body Finder, #2)",Kimberly Derting,4.07,-0.6486,negative
563887,The Littles,"John Lawrence Peterson, Roberta Carter Clark",3.98,0.0,neutral
155106,Amelia Bedelia and the Surprise Shower,"Peggy Parish, Barbara Siebel Thomas",4.27,0.2732,neutral
12125,"Homecoming (Tillerman Cycle, #1)",Cynthia Voigt,3.92,0.0,neutral
112751,"Spell of the Highlander (Highlander, #7)",Karen Marie Moning,4.27,0.0,neutral
28482,"The Hand of Chaos (The Death Gate Cycle, #5)","Margaret Weis, Tracy Hickman",4.05,-0.6597,negative
382680,One False Move (Myron Bolitar #5),Harlan Coben,4.07,0.0,neutral
62012,The Guns of Avalon (The Chronicles of Amber #2),Roger Zelazny,4.16,0.0,neutral
163465,The Great Gilly Hopkins,Katherine Paterson,3.83,0.6249,positive
32807,"Trojan Odyssey (Dirk Pitt, #17)",Clive Cussler,3.92,0.0,neutral
138872,Follow the River,James Alexander Thom,4.21,0.0,neutral
91571,Measure for Measure,"William Shakespeare, Barbara A. Mowat, Paul Werstine",3.67,0.0,neutral
228221,The Mask,"Owen  West, Dean Koontz",3.75,0.0,neutral
13514612,All Our Yesterdays,Cristin Terrill,4.05,0.0,neutral
16218778,Coming Clean,Kimberly Rae Miller,3.88,0.4019,neutral
5368,Forever Amber ,Kathleen Winsor,3.98,0.0,neutral
8619814,"The Emerald Atlas (The Books of Beginning, #1)",John  Stephens,3.92,0.0,neutral
28390369,Swing Time,Zadie Smith,3.6,0.0,neutral
42435,In Harm's Way: The Sinking of the U.S.S. Indianapolis and the Extraordinary Story of Its Survivors,Doug Stanton,4.25,0.0,neutral
1819632,"Chibi Vampire, Vol. 01",Yuna Kagesaki,3.99,0.0,neutral
18667779,Everything Leads to You,Nina LaCour,3.89,0.0,neutral
363851,Jeremy Fink and the Meaning of Life,Wendy Mass,4.02,0.0,neutral
216048,"Thank You, Mr. Falker",Patricia Polacco,4.52,0.3612,neutral
20821159,The Peripheral,William Gibson,3.94,0.0,neutral
6464937,Too Much Happiness,Alice Munro,3.82,0.5574,positive
13614836,"Tempting the Best Man (Gamble Brothers, #1)","J. Lynn, Jennifer L. Armentrout",3.73,0.6369,positive
17158513,"Captive Prince: Volume Two (Captive Prince, #2)",C.S. Pacat,4.51,0.0,neutral
10970532,"The Siren (The Original Sinners, #1)",Tiffany Reisz,4.05,0.3182,neutral
267243,Ironweed,William  Kennedy,3.86,0.0,neutral
6621101,"Deception (Alex Delaware, #25)",Jonathan Kellerman,3.96,-0.4404,neutral
40580,Stupid White Men,Michael Moore,3.3,-0.5267,negative
23766634,"A Court of Wings and Ruin (A Court of Thorns and Roses, #3)",Sarah J. Maas,4.54,-0.5859,negative
4893390,"The Faceless Ones (Skulduggery Pleasant, #3)",Derek Landy,4.4,0.5106,positive
63689,The Great Railway Bazaar,Paul Theroux,3.91,0.6249,positive
13117308,"Black List (Scot Harvath, #11)",Brad Thor,4.2,0.0,neutral
22417,"Transmetropolitan, Vol. 2: Lust for Life (Transmetropolitan, #2)","Warren Ellis, Darick Robertson",4.35,0.0,neutral
101869,"The Atrocity Archives (Laundry Files, #1)",Charles Stross,3.95,0.0,neutral
10867,The Pleasure of My Company,Steve Martin,3.78,0.5719,positive
138683,"Dark Fire (Matthew Shardlake, #2)",C.J. Sansom,4.24,-0.34,neutral
17831619,"Beautiful Beginning (Beautiful Bastard, #3.5)",Christina Lauren,4.24,0.1027,neutral
11381910,Heft,Liz Moore,3.96,0.0,neutral
7998,"Outcast of Redwall (Redwall, #8)",Brian Jacques,3.9,0.0,neutral
543873,Mister Pip,Lloyd Jones,3.66,0.0,neutral
1191,Giada's Family Dinners,"Giada De Laurentiis, Victoria Pearson",3.99,0.0,neutral
185012,Doubt,John Patrick Shanley,4.13,-0.3612,neutral
675614,"Book of Shadows (Sweep, #1)",Cate Tiernan,4.04,0.0,neutral
2141830,"Secrets of a Shoe Addict (Shoe Addict, #2)",Beth Harbison,3.73,0.0,neutral
22609080,"After We Fell (After, #3)",Anna Todd,3.88,0.0,neutral
6589074,Elizabeth Street,Laurie Fabiano,3.9,0.0,neutral
13415554,"The Assassin and the Pirate Lord (Throne of Glass, #0.1)",Sarah J. Maas,4.23,0.0,neutral
24965,Fear and Trembling,"Søren Kierkegaard, Alastair Hannay",4.01,-0.6908,negative
30334,"Hawksong (The Kiesha'ra, #1)",Amelia Atwater-Rhodes,4.15,0.0,neutral
45260,"The Naked God (Night's Dawn, #3)",Peter F. Hamilton,4.2,0.2732,neutral
14481,"Come Back, Amelia Bedelia","Peggy Parish, Wallace Tripp",4.25,0.0,neutral
790171,Kon-Tiki: Across The Pacific In A Raft,Thor Heyerdahl,4.1,0.0,neutral
15815364,How to Get Filthy Rich in Rising Asia,Mohsin Hamid,3.76,0.5574,positive
15852,Relativity: The Special and the General Theory,"Albert Einstein, Nigel Calder, Robert W. Lawson",4.17,0.4019,neutral
33770,Getting Over It,Anna Maxted,3.53,0.0,neutral
10866233,The List,Siobhan Vivian,3.46,0.0,neutral
19534,The Brothers K,David James Duncan,4.39,0.0,neutral
9484114,The Happiness Advantage: The Seven Principles of Positive Psychology That Fuel Success and Performance at Work,Shawn Achor,4.15,0.9169,positive
13167796,"A Dog's Journey (A Dog's Purpose, #2)",W. Bruce Cameron,4.41,0.0,neutral
11389341,The Meaning of Marriage: Facing the Complexities of Commitment with the Wisdom of God,"Timothy J. Keller, Kathy  Keller",4.43,0.7964,positive
6672183,Batman & Robin: Batman Reborn,"Grant Morrison, Frank Quitely, Philip Tan, Jonathan Glapion, Alex Sinclair",4.08,0.3612,neutral
1157452,"MeruPuri, Vol. 1 (MeruPuri, #1)",Matsuri Hino,4.14,0.0,neutral
11031,The Flanders Panel,"Arturo Pérez-Reverte, Margaret Jull Costa",3.8,0.0,neutral
576570,The Princess and the Pea,"Janet Stevens, Hans Christian Andersen",4.1,0.0,neutral
4662,The Short Stories,"F. Scott Fitzgerald, Matthew J. Bruccoli",4.23,0.0,neutral
397466,"Dark Angel (Casteel, #2)",V.C. Andrews,3.96,0.0,neutral
77787,"Specter of the Past (Star Wars: The Hand of Thrawn, #1)",Timothy Zahn,3.98,-0.1027,neutral
25507925,Binge,Tyler Oakley,4.3,0.0,neutral
22471294,Black Lies,Alessandra Torre,4.32,-0.4215,neutral
351648,What the Dead Know,Laura Lippman,3.54,-0.6486,negative
17798233,"Rome (Marked Men, #3)","Jay Crownover, Charlotte Connan de vries",4.22,0.0,neutral
76527,"The Life and Opinions of Tristram Shandy, Gentleman","Laurence Sterne, Melvyn New",3.74,0.0,neutral
765148,Giraffes Can't Dance,"Giles Andreae, Guy Parker-Rees",4.28,0.0,neutral
98048,The Passion of Artemisia,Susan Vreeland,3.86,0.4588,neutral
270435,Heal Your Body: The Mental Causes for Physical Illness and the Metaphysical Way to Overcome Them,Louise L. Hay,4.34,-0.4019,neutral
284698,"Tokyo Mew Mew, Vol. 1 (Tokyo Mew Mew, #1)","Mia Ikumi, Reiko Yoshida",3.95,-0.296,neutral
11595276,The Miseducation of Cameron Post,Emily M. Danforth,3.99,0.0,neutral
1967070,Coraline (Illustrated/Graphic Novel Edition),"Neil Gaiman, P. Craig Russell",3.96,0.3182,neutral
2173611,"House of Many Ways (Howl's Moving Castle, #3)",Diana Wynne Jones,4.03,0.0,neutral
23602561,The Cartel,Don Winslow,4.28,0.0,neutral
25937671,A Mother's Reckoning: Living in the Aftermath of Tragedy,Sue Klebold,4.13,-0.6597,negative
13062,"Skin Tight (Mick Stranahan, #1)",Carl Hiaasen,3.96,0.0,neutral
3750,"Moonraker (James Bond, #3)",Ian Fleming,3.7,0.0,neutral
364550,Two Treatises of Government,"John Locke, Peter Laslett, Raymond Geuss",3.81,0.0,neutral
16900,Civil Disobedience and Other Essays,Henry David Thoreau,4.06,0.0,neutral
17533,"Rose in Bloom (Eight Cousins, #2)",Louisa May Alcott,4.03,0.0,neutral
18718848,Mosquitoland,David  Arnold,3.92,0.0,neutral
25228579,The Perfect Son,Barbara Claypole White,3.97,0.5719,positive
82436,Looking for Alibrandi,Melina Marchetta,3.85,0.0,neutral
17257993,"Raid (Unfinished Hero, #3)",Kristen Ashley,4.23,0.5574,positive
15813668,"Fifth Grave Past the Light (Charley Davidson, #5)",Darynda Jones,4.49,-0.3818,neutral
416580,"The Seventh Scroll (Ancient Egypt, #2)",Wilbur Smith,4.1,0.0,neutral
12813860,A Midsummer's Nightmare,Kody Keplinger,3.83,0.0,neutral
17571466,The Troop,Nick Cutter,3.71,0.0,neutral
820480,"Revelation (Matthew Shardlake, #4)",C.J. Sansom,4.32,0.0,neutral
11339,100 Love Sonnets,"Pablo Neruda, Stephen Tapscott",4.4,0.6369,positive
18316089,Lucky Us,Amy Bloom,3.21,0.4215,neutral
110393,"It's in His Kiss (Bridgertons, #7)",Julia Quinn,4.01,0.4215,neutral
31538614,"Short Stories from Hogwarts of Power, Politics and Pesky Poltergeists (Pottermore Presents, #2)","J.K. Rowling, MinaLima",4.2,-0.296,neutral
9454,Phenomenology of Spirit,"Georg Wilhelm Friedrich Hegel, A.V. Miller, John Niemeyer Findlay",3.91,0.1779,neutral
17257990,"Fire Inside (Chaos, #2)",Kristen Ashley,4.33,-0.34,neutral
479561,"The Neutronium Alchemist (Night's Dawn, #2)",Peter F. Hamilton,4.25,0.0,neutral
9995135,The Darkest Seduction (Lords of the Underworld #9),Gena Showalter,4.35,-0.4939,neutral
30226723,"King's Cage (Red Queen, #3)",Victoria Aveyard,4.03,0.0,neutral
6345193,Invisible,Paul Auster,3.71,0.0,neutral
5557442,ظل الأفعى,يوسف زيدان,3.0,0.0,neutral
9266810,Ten Things We Did (and Probably Shouldn't Have),Sarah Mlynowski,3.74,0.0,neutral
13042154,"Rebel Heart (Dust Lands, #2)",Moira Young,3.89,-0.1531,neutral
4507,Sickened: The Memoir of a Munchausen by Proxy Childhood,Julie Gregory,3.72,-0.5423,negative
96082,The Last Time They Met,Anita Shreve,3.48,0.0,neutral
25817493,News of the World,Paulette Jiles,4.14,0.0,neutral
40710,"Blowback (Scot Harvath, #4)",Brad Thor,4.17,0.0,neutral
9864913,Jaya: An Illustrated Retelling of the Mahabharata,Devdutt Pattanaik,4.2,0.0,neutral
51114,Women of the Silk,Gail Tsukiyama,3.94,0.0,neutral
54492,The Prisoner of Zenda,Anthony Hope,3.87,-0.1531,neutral
8349348,"Flutter (My Blood Approves, #3)",Amanda Hocking,3.97,0.4019,neutral
18089551,"Tall, Tatted and Tempting (The Reed Brothers, #1)",Tammy Falkner,4.23,0.0,neutral
456,Leviathan,Paul Auster,3.95,0.0,neutral
15157,Saving Faith,David Baldacci,3.82,0.4215,neutral
171471,"The Spine of the World (Forgotten Realms: Paths of Darkness, #2; Legend of Drizzt, #12)",R.A. Salvatore,3.89,-0.25,neutral
308540,"The Haunted Mask (Goosebumps, #11)",R.L. Stine,3.77,-0.4767,neutral
136641,Tyrannosaur Canyon (Wyman Ford #1),Douglas Preston,3.78,0.0,neutral
28016509,The Girl Before,J.P. Delaney,3.7,0.0,neutral
15673,Wayside School Gets A Little Stranger (Wayside School #3),Louis Sachar,4.18,0.0,neutral
11279,Summer of Night,Dan Simmons,4.0,0.0,neutral
4961959,"The Dresden Files:  Storm Front, Volume 1-  The Gathering Storm","Jim Butcher, Mark Powers, Ardian Syaf",4.36,0.0,neutral
13064,Tourist Season,Carl Hiaasen,3.95,0.0,neutral
16076787,السنجة,أحمد خالد توفيق,3.16,0.0,neutral
366346,"204 Rosewood Lane (Cedar Cove, #2)",Debbie Macomber,4.15,0.0,neutral
16071767,"Unseen (Will Trent, #7)",Karin Slaughter,4.17,0.0,neutral
6681333,"Eleventh Grade Burns (The Chronicles of Vladimir Tod, #4)",Heather Brewer,4.31,0.0,neutral
175324,Double Star,Robert A. Heinlein,3.88,0.0,neutral
390305,"A Perfect Evil (Maggie O'Dell, #1)",Alex Kava,4.02,-0.1779,neutral
15737147,Help Thanks Wow: The Three Essential Prayers,Anne Lamott,3.97,0.8555,positive
7981,"The Long Patrol (Redwall, #10)","Brian Jacques, Allan Curless",4.1,0.0,neutral
11107244,The Better Angels of Our Nature: Why Violence Has Declined,Steven Pinker,4.19,-0.296,neutral
821003,"When We Were Very Young (Winnie-the-Pooh, #3)","A.A. Milne, Ernest H. Shepard",4.32,0.0,neutral
22367526,My Sunshine Away,M.O. Walsh,3.6,0.4939,neutral
370057,The Truth Seeker (O'Malley #3),Dee Henderson,4.39,0.3182,neutral
1244286,Filosofi Kopi: Kumpulan Cerita dan Prosa Satu Dekade,Dee Lestari,3.82,0.0,neutral
364826,سینوهه,"Mika Waltari, ذبیح‌الله منصوری",4.08,0.0,neutral
7907782,Great House,Nicole Krauss,3.45,0.6249,positive
28374062,"The Kept Woman (Will Trent, #8)",Karin Slaughter,4.1,0.0,neutral
11808919,"Maid for Love (Gansett Island Series, #1)",Marie Force,3.98,0.6369,positive
95619,And the Shofar Blew,Francine Rivers,4.11,0.0,neutral
31357,"Prentice Alvin (Tales of Alvin Maker, #3)",Orson Scott Card,3.77,0.0,neutral
97875,"44 Scotland Street (44 Scotland Street, #1)",Alexander McCall Smith,3.61,0.0,neutral
268275,Chill Factor,Sandra Brown,3.95,0.0,neutral
2108198,Odd and the Frost Giants,"Neil Gaiman, Mark Buckingham",3.95,-0.3182,neutral
17726978,The Magpies,Mark  Edwards,3.8,0.0,neutral
669780,Season of Migration to the North,"Tayeb Salih, Denys Johnson-Davies",3.71,0.0,neutral
24100,The Golden Notebook,Doris Lessing,3.75,0.0,neutral
396266,"The Winter Rose (The Tea Rose, #2)",Jennifer Donnelly,4.29,0.0,neutral
