book_id,title,authors,average_rating,sentiment_score,sentiment_label
8476248,Just Like Heaven (Smythe-Smith Quartet #1),Julia Quinn,3.93,0.7003,positive
6443349,"Percy Jackson and the Olympians Boxed Set (Percy Jackson and the Olympians, #1-5)","Rick Riordan, Tk",4.57,0.0,neutral
11720382,"Catch Me (Detective D.D. Warren, #6)",Lisa Gardner,4.17,0.0,neutral
233044,"The Shop on Blossom Street (Blossom Street, #1)",Debbie Macomber,4.04,0.0,neutral
239102,"Starless Night (Forgotten Realms: Legacy of the Drow, #2; Legend of Drizzt, #8)",R.A. Salvatore,4.12,0.0,neutral
93788,"Night Fall (John Corey, #3)",Nelson DeMille,4.07,0.0,neutral
8967,"Trials of Death (Cirque Du Freak, #5)",Darren Shan,4.25,-0.7783,negative
7144426,"The Bourne Objective (Jason Bourne, #8)","Eric Van Lustbader, Robert Ludlum",4.07,0.0,neutral
27252717,"The Score (Off-Campus, #3)",Elle Kennedy,4.27,0.0,neutral
289644,"Even Now (Lost Love, #1)",Karen Kingsbury,4.26,0.6369,positive
3121162,Testimony,Anita Shreve,3.54,0.0,neutral
11544421,"Magic Rises (Kate Daniels, #6)",Ilona Andrews,4.49,0.0,neutral
9970042,"Whispers Under Ground (Peter Grant, #3)",Ben Aaronovitch,4.16,0.3612,neutral
18453095,"Unlucky 13 (Women’s Murder Club, #13)","James Patterson, Maxine Paetro",3.94,-0.6908,negative
99610,The Best Laid Plans,Sidney Sheldon,3.66,0.6369,positive
2855034,Nation,Terry Pratchett,4.05,0.0,neutral
114162,"Secrets of a Summer Night (Wallflowers, #1)",Lisa Kleypas,4.05,0.0,neutral
456028,"Red: The Heroic Rescue (The Circle, #2)",Ted Dekker,4.3,0.7845,positive
10680329,"A Trick of the Light (Chief Inspector Armand Gamache, #7)",Louise Penny,4.29,-0.0516,neutral
17455585,"White Hot Kiss (The Dark Elements, #1)",Jennifer L. Armentrout,4.28,0.4215,neutral
1717890,Pandora Hearts 1巻,"Jun Mochizuki, 望月淳",4.2,0.0,neutral
32769,At the Mountains of Madness and Other Tales of Terror,H.P. Lovecraft,4.25,-0.743,negative
6340016,Lit,Mary Karr,3.88,0.0,neutral
465904,"Dragonsdawn (Pern, #9)",Anne McCaffrey,4.17,0.0,neutral
6596547,Mockingbird,Kathryn Erskine,4.18,0.0,neutral
13489517,28 حرف,أحمد حلمي,3.1,0.0,neutral
107195,I Kissed Dating Goodbye,Joshua Harris,3.61,0.3818,neutral
903,"The Egypt Game (Game, #1)",Zilpha Keatley Snyder,3.81,0.0,neutral
277397,Ellen Foster,Kaye Gibbons,3.75,0.0,neutral
22904,The Complete Stories,"Franz Kafka, Nahum N. Glatzer, John Updike, Willa Muir, Edwin Muir, Tania Stern, James Stern, Ernst Kaiser, Eithne Wilkins",4.34,0.0,neutral
1059680,Veganomicon: The Ultimate Vegan Cookbook,"Isa Chandra Moskowitz, Terry Hope Romero",3.98,0.4404,neutral
260025,"Test of the Twins (Dragonlance: Legends, #3)","Margaret Weis, Tracy Hickman",4.16,0.0,neutral
48467,Wise Blood,Flannery O'Connor,3.88,0.4767,neutral
220826,Kürk Mantolu Madonna,Sabahattin Ali,4.49,0.0,neutral
187124,"Running with the Demon (Word & Void, #1)",Terry Brooks,3.95,0.0,neutral
223838,In His Steps,Charles M. Sheldon,4.15,0.0,neutral
10790516,Lothaire (Immortals After Dark #12),Kresley Cole,4.43,0.0,neutral
515905,"Knuffle Bunny Too: A Case of Mistaken Identity (Knuffle Bunny, #2)",Mo Willems,4.28,-0.3612,neutral
2260637,"The Whole Truth (A. Shaw, #1)",David Baldacci,4.0,0.3182,neutral
2659997,"Stolen Innocence: My Story of Growing Up in a Polygamous Sect, Becoming a Teenage Bride, and Breaking Free of Warren Jeffs","Elissa Wall, Lisa Pulitzer",3.89,0.5267,positive
11178225,Out of the Easy,Ruta Sepetys,4.05,0.4404,neutral
2182780,Batman: The Man Who Laughs,"Ed Brubaker, Doug Mahnke, Patrick Zircher, Aaron Sowd, Steve Bird",4.09,0.4939,neutral
273511,"Midnight (Warriors: The New Prophecy, #1)",Erin Hunter,4.26,0.0,neutral
18176747,The Hard Thing About Hard Things: Building a Business When There Are No Easy Answers,Ben Horowitz,4.2,-0.0258,neutral
11051889,"The Fallen Star (Fallen Star, #1)",Jessica Sorensen,3.91,-0.3612,neutral
228990,"The Illearth War (The Chronicles of Thomas Covenant the Unbeliever, #2)",Stephen R. Donaldson,3.99,-0.5994,negative
2063563,My Booky Wook,Russell Brand,3.42,0.0,neutral
18527947,"Shadow Spell (The Cousins O'Dwyer Trilogy, #2)",Nora Roberts,4.0,0.0,neutral
10909804,Just My Type: A Book About Fonts,Simon Garfield,3.79,0.0,neutral
3492020,"Promises in Death (In Death, #28)",J.D. Robb,4.4,-0.7351,negative
23534,Love Is a Dog from Hell,Charles Bukowski,4.16,-0.1027,neutral
19161852,"The Fifth Season (The Broken Earth, #1)",N.K. Jemisin,4.31,-0.4767,neutral
13568322,The Zombie Room,R.D. Ronald,3.61,0.0,neutral
67931,The Analyst,John Katzenbach,4.12,0.0,neutral
2113260,Shades of Grey,Jasper Fforde,4.14,0.0516,neutral
33569,"That Was Then, This Is Now",S.E. Hinton,3.89,0.0,neutral
6164358,"The Mysterious Benedict Society and the Prisoner's Dilemma (The Mysterious Benedict Society, #3)","Trenton Lee Stewart, Del Roy",4.28,-0.1779,neutral
10149142,The Family Fang,Kevin    Wilson,3.6,0.0,neutral
10907,The Pursuit of Happyness,Chris Gardner,4.17,0.0,neutral
7147831,Min kamp 1 (Min kamp #1),Karl Ove Knausgård,4.08,0.0,neutral
8517008,"A Red Herring Without Mustard (Flavia de Luce, #3)",Alan Bradley,4.07,0.0,neutral
18728,No Ordinary Time: Franklin and Eleanor Roosevelt: The Home Front in World War II,Doris Kearns Goodwin,4.2,-0.7269,negative
414298,Straight Man,Richard Russo,4.02,0.2263,neutral
10739,The Moviegoer,Walker Percy,3.7,0.0,neutral
87346,The Cherry Orchard,"Anton Chekhov, Tom    Murphy",3.68,0.0,neutral
4835838,"11 Birthdays (Willow Falls, #1)",Wendy Mass,4.18,0.0,neutral
7329,Unfinished Tales of Númenor and Middle-Earth,"J.R.R. Tolkien, Christopher Tolkien",3.93,0.0,neutral
9461872,"Sisterhood Everlasting (Sisterhood, #5)",Ann Brashares,3.9,0.0,neutral
349090,Infinity Welcomes Careful Drivers (Red Dwarf #1),Grant Naylor,4.03,0.7003,positive
33459,Coyote Blue,Christopher Moore,3.75,0.0,neutral
2501455,فوضى الحواس,"أحلام مستغانمي, Ahlam Mosteghanemi",3.83,0.0,neutral
87665,Orthodoxy,G.K. Chesterton,4.23,0.0,neutral
426625,Fancy Nancy,"Jane O'Connor, Robin Preiss Glasser",4.15,0.0,neutral
3692,The Heart of the Matter,Graham Greene,3.98,0.0258,neutral
21535019,"The Long Haul (Diary of a Wimpy Kid, #9)",Jeff Kinney,4.33,-0.2263,neutral
169871,"Talking to Dragons (Enchanted Forest Chronicles, #4)","Patricia C. Wrede, Peter de Sève",4.19,0.0,neutral
2029176,Sail,"James Patterson, Howard Roughan",3.8,0.0,neutral
23301545,The Sleeper and the Spindle,"Neil Gaiman, Chris Riddell",3.9,0.0,neutral
18114142,A Fall of Marigolds,Susan Meissner,4.04,0.0,neutral
18750,"Beauty's Punishment (Sleeping Beauty, #2)","A.N. Roquelaure, Anne Rice",3.62,0.1531,neutral
285011,"The Negotiator (O'Malley, #1)",Dee Henderson,4.32,0.0,neutral
13041934,Can Love Happen Twice?,Ravinder Singh,3.31,0.6369,positive
3124249,"A Lion Among Men (The Wicked Years, #3)","Gregory Maguire, Douglas Smith",3.29,-0.5267,negative
43908,"Shadow of a Dark Queen (The Serpentwar Saga, #1)",Raymond E. Feist,4.02,0.0,neutral
11466,This Boy's Life,Tobias Wolff,3.98,0.0,neutral
3993839,"Patient Zero (Joe Ledger, #1)",Jonathan Maberry,3.98,0.0,neutral
545951,Death Comes for the Archbishop,Willa Cather,3.88,-0.5994,negative
7942786,"Fair Game (Alpha & Omega, #3)",Patricia Briggs,4.34,0.3182,neutral
17312201,"The Son of Sobek (Percy Jackson & Kane Chronicles Crossover, #1)",Rick Riordan,4.26,0.0,neutral
52823,Tartuffe,"Molière, Martin Sorrell",3.66,0.0,neutral
4701550,Passion Unleashed (Demonica #3),Larissa Ione,4.32,0.4588,neutral
1896346,"High School Debut, Vol. 01 (High School Debut, #1)",Kazune Kawahara,4.11,0.0,neutral
10400407,في ديسمبر تنتهي كل الأحلام,أثير عبدالله النشمي,3.33,0.0,neutral
386234,Just for You (Little Critter),Mercer Mayer,4.25,0.0,neutral
294047,Amazonia,James Rollins,4.11,0.0,neutral
46674,Feeling Good: The New Mood Therapy,David D. Burns,3.95,0.5267,positive
114184,Blue Smoke,Nora Roberts,3.97,0.0,neutral
6528,"Predator (Kay Scarpetta, #14)",Patricia Cornwell,3.67,0.0,neutral
720298,Codependent No More: How to Stop Controlling Others and Start Caring for Yourself,Melody Beattie,4.13,-0.1189,neutral
254308,Oblomov,"Ivan Goncharov, Stephen Pearl, Galya Diment",4.0,0.0,neutral
198332,"Inca Gold (Dirk Pitt, #12)",Clive Cussler,3.96,0.0,neutral
18167006,Delicious!,Ruth Reichl,3.75,0.6114,positive
6496815,NurtureShock: New Thinking About Children,"Po Bronson, Ashley Merryman",4.04,-0.5574,negative
1849,"Wild Fire (John Corey, #4)",Nelson DeMille,3.99,-0.34,neutral
154423,Two Little Girls in Blue,Mary Higgins Clark,3.85,0.0,neutral
589979,"Daughter of the Empire (The Empire Trilogy, #1)","Raymond E. Feist, Janny Wurts",4.24,0.0,neutral
688191,"Everlost (Skinjacker, #1)",Neal Shusterman,3.94,0.0,neutral
8534799,Dreams of a Dark Warrior (Immortals After Dark #11),Kresley Cole,4.39,0.4019,neutral
7824997,"Theodore Boone: Kid Lawyer (Theodore Boone, #1)","John Grisham, Richard Thomas",3.72,0.0,neutral
34072,"Jimmy Corrigan, the Smartest Kid on Earth",Chris Ware,4.1,0.6124,positive
39980,"A Year Down Yonder (A Long Way from Chicago, #2)",Richard Peck,4.1,0.0,neutral
16163690,"Own the Wind (Chaos, #1)",Kristen Ashley,4.22,0.0,neutral
4516,Marina,Carlos Ruiz Zafón,3.99,0.0,neutral
7135858,My Name Is Memory,Ann Brashares,3.7,0.0,neutral
15054,Written on the Body,Jeanette Winterson,4.08,0.0,neutral
7849341,"Tiger's Voyage (The Tiger Saga, #3)",Colleen Houck,4.35,0.0,neutral
605015,"Dead and Alive (Dean Koontz's Frankenstein, #3)",Dean Koontz,4.01,-0.4019,neutral
4591,Genome: the Autobiography of a Species in 23 Chapters,Matt Ridley,4.02,0.0,neutral
53580,The Going-To-Bed Book,Sandra Boynton,4.22,0.0,neutral
112675,"Knocked Out by My Nunga-Nungas (Confessions of Georgia Nicolson, #3)",Louise Rennison,3.97,0.0,neutral
27526,"Desecration (Left Behind, #9)","Tim LaHaye, Jerry B. Jenkins",4.0,0.0,neutral
18114068,Redeployment,Phil Klay,3.98,0.0,neutral
6512140,Going Bovine,Libba Bray,3.65,0.0,neutral
25807,The Postman Always Rings Twice,James M. Cain,3.81,0.0,neutral
6555517,"The Dead-Tossed Waves (The Forest of Hands and Teeth, #2)",Carrie Ryan,3.91,0.0,neutral
9530,Shadow Divers,Robert Kurson,4.26,0.0,neutral
8293938,Moon Over Manifest,Clare Vanderpool,4.02,0.0,neutral
77103,The Glass Palace,Amitav Ghosh,3.94,0.0,neutral
10710392,Chopsticks,"Jessica Anthony, Rodrigo Corral",3.72,0.0,neutral
21853628,Every Fifteen Minutes,Lisa Scottoline,3.72,0.0,neutral
16279856,"The Eye of Minds (The Mortality Doctrine, #1)",James Dashner,3.85,0.0,neutral
140278,"4:50 from Paddington (Miss Marple, #8)",Agatha Christie,3.92,0.0,neutral
74036,"Ceremony in Death (In Death, #5)",J.D. Robb,4.26,-0.8316,negative
18373214,"Cockroaches (Harry Hole, #2)","Jo Nesbø, Don Bartlett",3.71,0.0,neutral
140078,"Grave Surprise (Harper Connelly, #2)",Charlaine Harris,3.88,-0.128,neutral
3304,"City of the Beasts (Eagle and Jaguar, #1)","Isabel Allende, Margaret Sayers Peden",3.69,0.0,neutral
2364284,أولاد حارتنا,"Naguib Mahfouz, نجيب محفوظ",4.1,0.0,neutral
68497,"The Scar (Bas-Lag, #2)",China Miéville,4.15,0.0,neutral
23225,"Haunted (The Mediator, #5)",Meg Cabot,4.15,-0.4767,neutral
28553,"Dragondrums (Harper Hall, #3)",Anne McCaffrey,4.04,0.0,neutral
9545064,The Story of Beautiful Girl,Rachel Simon,3.92,0.5994,positive
18646,"Galileo's Daughter: A Historical Memoir of Science, Faith and Love",Dava Sobel,3.74,0.7906,positive
42692,Mila 18,Leon Uris,4.27,0.0,neutral
11391817,Drawing from Memory,Allen Say,3.81,0.0,neutral
1330324,"Sea of Poppies (Ibis Trilogy, #1)",Amitav Ghosh,3.93,0.0,neutral
99245,Nightfall,"Isaac Asimov, Robert Silverberg",4.01,0.0,neutral
18005,How I Became a Pirate,"Melinda Long, David Shannon",4.07,0.0,neutral
99208,"The Monkey Wrench Gang (Monkey Wrench Gang, #1)",Edward Abbey,4.08,0.0,neutral
6323821,Last Night in Twisted River,John Irving,3.74,0.0,neutral
10115852,"Love Wins: A Book About Heaven, Hell, and the Fate of Every Person Who Ever Lived",Rob Bell,3.54,0.4588,neutral
9376345,"Bite Club (The Morganville Vampires, #10)",Rachel Caine,4.23,0.0,neutral
78970,A Matter of Honor,Jeffrey Archer,3.9,0.5106,positive
469901,Mr. Perfect,Linda Howard,4.07,0.5719,positive
16093188,"Up to Me (The Bad Boys, #2)",M. Leighton,4.12,-0.5423,negative
16124019,"Waking Up Married (Waking Up, #1)",Mira Lyn Kelly,3.53,0.0,neutral
1225261,No Time for Goodbye (No Time For Goodbye #1),Linwood Barclay,4.0,-0.296,neutral
207802,"Ida B. . . and Her Plans to Maximize Fun, Avoid Disaster, and (Possibly) Save the World",Katherine Hannigan,3.86,0.0516,neutral
4703450,"The Dragon Keeper (Rain Wild Chronicles, #1)",Robin Hobb,3.93,0.0,neutral
210404,A Sand County Almanac and Sketches Here and There,Aldo Leopold,4.24,0.0,neutral
895886,Lassie Come-Home,"Eric Knight, Marguerite Kirmse",4.16,0.0,neutral
178788,"The China Study: The Most Comprehensive Study of Nutrition Ever Conducted And the Startling Implications for Diet, Weight Loss, And Long-term Health","T. Colin Campbell, Thomas M. Campbell II",4.21,0.0754,neutral
1013383,The Gruffalo,"Julia Donaldson, Axel Scheffler",4.47,0.0,neutral
359,"The Salmon of Doubt (Dirk Gently, #3)",Douglas Adams,3.92,0.128,neutral
250024,The City and the Stars,Arthur C. Clarke,4.08,0.0,neutral
18667307,"Tokyo Ghoul, tome 1 (Tokyo Ghoul, #1)","Sui Ishida, 石田 スイ",4.43,0.0,neutral
352262,"How to Train Your Dragon (How to Train Your Dragon, #1)",Cressida Cowell,3.85,0.0,neutral
6753,Brief Interviews with Hideous Men,David Foster Wallace,3.88,0.0,neutral
170619,All Around the Town,Mary Higgins Clark,3.94,0.0,neutral
4758093,"L.A. Candy (L.A. Candy, #1)",Lauren Conrad,3.36,0.0,neutral
6618272,The Siren,Kiera Cass,3.78,0.0,neutral
43993,The Quiet Game,Greg Iles,4.17,0.0,neutral
22680,American Sphinx: The Character of Thomas Jefferson,Joseph J. Ellis,3.9,0.0,neutral
11777020,Headhunters,"Jo Nesbø, Don Bartlett",3.78,0.0,neutral
93793,"The Messenger (Gabriel Allon, #6)",Daniel Silva,4.18,0.0,neutral
243598,The Sheltering Sky,Paul Bowles,3.92,0.0,neutral
22910900,The Rest of Us Just Live Here,Patrick Ness,3.76,0.0,neutral
1933181,The Lady Elizabeth,Alison Weir,3.97,0.0,neutral
16131193,The Astronaut Wives Club,Lily Koppel,3.26,0.0,neutral
184419,The Man Who Was Thursday: A Nightmare,"G.K. Chesterton, Jonathan Lethem",3.85,0.0,neutral
764903,Cheaper by the Dozen,"Frank B. Gilbreth Jr., Ernestine Gilbreth Carey",3.99,0.0,neutral
2198274,The Monster of Florence,"Douglas Preston, Mario Spezi",3.72,0.0,neutral
112525,Winter's Bone,Daniel Woodrell,3.92,0.0,neutral
30243,"Seduced by Moonlight (Merry Gentry, #3)",Laurell K. Hamilton,4.05,-0.3612,neutral
1297150,"Sword Song (The Saxon Stories, #4)",Bernard Cornwell,4.28,0.0,neutral
1734639,Deceptively Delicious: Simple Secrets to Get Your Kids Eating Good Food,Jessica Seinfeld,3.39,0.765,positive
228534,The Weight of Water,Anita Shreve,3.62,0.0,neutral
16062210,"Music of the Heart (Runaway Train, #1)",Katie Ashley,4.0,0.0,neutral
41951,Scarlet Feather,Maeve Binchy,3.93,0.0,neutral
16070018,"Truth (Consequences, #2)",Aleatha Romig,4.38,0.3182,neutral
34503,"The Last Hero (Discworld, #27; Rincewind #7)","Terry Pratchett, Paul Kidby",4.15,0.5574,positive
83539,Fantastic Voyage,Isaac Asimov,3.89,0.5574,positive
11472,We Wish to Inform You That Tomorrow We Will Be Killed with Our Families,Philip Gourevitch,4.3,-0.4215,neutral
12611073,The Harbinger: The Ancient Mystery that Holds the Secret of America's Future,Jonathan Cahn,3.93,0.0,neutral
16248078,"The English Girl (Gabriel Allon, #13)",Daniel Silva,4.08,0.0,neutral
8296140,Clara and Mr. Tiffany,Susan Vreeland,3.71,0.0,neutral
18295852,The Geography of You and Me,Jennifer E. Smith,3.68,0.0,neutral
7991200,"Angel (Angel, #1)",L.A. Weatherly,3.89,0.0,neutral
11254850,"Seeds of Rebellion (Beyonders, #2)",Brandon Mull,4.25,-0.128,neutral
82751,Chinese Cinderella: The True Story of an Unwanted Daughter,Adeline Yen Mah,4.04,0.2263,neutral
14785,"Chosen Prey (Lucas Davenport, #12)",John Sandford,4.23,0.0,neutral
8320534,Raymond E. Feist's Magician Master,"Bryan J.L. Glass, Tim Seeley, Hugo Petrus, Raymond E. Feist",4.43,0.0,neutral
31140847,Bossman,Vi Keeland,4.25,0.0,neutral
2880715,The Black Dagger Brotherhood: An Insider's Guide,J.R. Ward,4.32,0.0,neutral
6120349,"Locke & Key, Vol. 2: Head Games","Joe Hill, Gabriel Rodríguez",4.36,0.0,neutral
91247,"Ramona and Her Father (Ramona, #4)","Beverly Cleary, Alan Tiegreen",4.02,0.0,neutral
49596,The Secret Adversary (Tommy and Tuppence #1),Agatha Christie,3.82,-0.2023,neutral
53413,Hopscotch,"Julio Cortázar, Gregory Rabassa",4.25,0.0,neutral
9635495,"Fallen (Will Trent, #5)",Karin Slaughter,4.23,-0.3612,neutral
25689074,"Stars Above (The Lunar Chronicles, #4.5)",Marissa Meyer,4.27,0.0,neutral
1207904,Clapton: The Autobiography,Eric Clapton,3.81,0.0,neutral
647,No Logo,Naomi Klein,3.86,-0.296,neutral
43927,No Second Chance,Harlan Coben,4.05,-0.0516,neutral
7748,Fear and Loathing on the Campaign Trail '72,Hunter S. Thompson,4.1,-0.7845,negative
764434,Shroud for a Nightingale (Adam Dalgliesh #4),P.D. James,4.04,0.0,neutral
21853633,"First Frost (Waverley Family, #2)",Sarah Addison Allen,3.95,0.0,neutral
223380,Stories of Your Life and Others,Ted Chiang,4.27,0.0,neutral
53926,Travesuras de la niña mala,Mario Vargas Llosa,4.04,0.0,neutral
6449290,The Girl Who Fell from the Sky,Heidi W. Durrow,3.6,0.0,neutral
4031,Lunar Park,Bret Easton Ellis,3.6,0.0,neutral
32523,"Hide (Detective D.D. Warren, #2)",Lisa Gardner,4.14,-0.1779,neutral
969177,Ayat-Ayat Cinta,Habiburrahman El-Shirazy,3.81,0.0,neutral
29519514,"Broken Prince (The Royals, #2)",Erin Watt,4.11,-0.4767,neutral
16054811,Manuscript Found in Accra,"Paulo Coelho, Margaret Jull Costa",3.8,0.0,neutral
9296438,Save Me,Lisa Scottoline,3.63,0.4939,neutral
52640,Weaveworld,Clive Barker,4.13,0.0,neutral
170650,"Loves Music, Loves to Dance",Mary Higgins Clark,3.89,0.8126,positive
215542,"The Rivers of Zadaa (Pendragon, #6)",D.J. MacHale,4.19,0.0,neutral
11227040,"Sweet Dreams (Colorado Mountain, #2)",Kristen Ashley,4.42,0.6908,positive
133486,Nicholas and Alexandra,Robert K. Massie,4.25,0.0,neutral
12275680,"Wicked Business (Lizzy & Diesel, #2)",Janet Evanovich,3.76,-0.5267,negative
16054808,Escape from Mr. Lemoncello's Library (Mr. Lemoncello's Library #1),Chris Grabenstein,4.13,0.1779,neutral
17208,Friday,Robert A. Heinlein,3.82,0.0,neutral
6926176,"Her Mother's Hope (Marta's Legacy, #1)",Francine Rivers,4.28,0.4404,neutral
97860,Tuesday,David Wiesner,4.17,0.0,neutral
19707,"Red Rabbit (Jack Ryan Universe, #3)",Tom Clancy,3.64,0.0,neutral
13986,"Arrows of the Queen (Heralds of Valdemar, #1)",Mercedes Lackey,4.16,0.0,neutral
424,Slouching Towards Bethlehem,Joan Didion,4.24,0.0,neutral
43917,"Rise of a Merchant Prince (The Serpentwar Saga, #2)",Raymond E. Feist,4.02,0.0,neutral
7285498,"Angelfire (Angelfire, #1)",Courtney Allison Moulton,3.93,0.0,neutral
12070846,Mile 81,Stephen King,3.62,0.0,neutral
446,The Brooklyn Follies,Paul Auster,3.81,0.0,neutral
277191,"The Ironwood Tree (The Spiderwick Chronicles, #4)","Holly Black, Tony DiTerlizzi",3.92,0.0,neutral
159582,The Yearling,Marjorie Kinnan Rawlings,3.99,0.0,neutral
13561164,"Dare You To (Pushing the Limits, #2)",Katie McGarry,4.18,0.0,neutral
6952423,I Am Ozzy,"Ozzy Osbourne, Chris Ayres",4.05,0.0,neutral
11077,The Sex Lives of Cannibals: Adrift in the Equatorial Pacific,J. Maarten Troost,3.87,0.0,neutral
10445208,"Touch of Power (Healer, #1)",Maria V. Snyder,4.17,0.0,neutral
5158,A Virtuous Woman,Kaye Gibbons,3.67,0.5267,positive
59819,"Tears of the Moon (Gallaghers of Ardmore / Irish Trilogy, #2)",Nora Roberts,4.19,-0.2263,neutral
8968,"The Vampire Prince (Cirque Du Freak, #6)",Darren Shan,4.23,-0.4404,neutral
291356,"The Sapphire Rose (The Elenium, #3)",David Eddings,3.98,0.0,neutral
24452249,Did You Ever Have a Family,Bill Clegg,3.81,0.0,neutral
33813,The Gold Coast,Nelson DeMille,4.06,0.0,neutral
781844,On Death and Dying,Elisabeth Kübler-Ross,4.15,-0.5994,negative
23346918,"14th Deadly Sin (Women’s Murder Club, #14)","James Patterson, Maxine Paetro",3.99,-0.8519,negative
827412,"It Happened One Autumn (Wallflowers, #2)",Lisa Kleypas,4.15,0.0,neutral
2833172,"Scarpetta (Kay Scarpetta, #16)",Patricia Cornwell,3.72,0.0,neutral
21681,"Darkness, Take My Hand (Kenzie & Gennaro, #2)",Dennis Lehane,4.17,0.296,neutral
239103,"Siege of Darkness (Forgotten Realms: Legacy of the Drow, #3; Legend of Drizzt, #9)",R.A. Salvatore,4.15,-0.25,neutral
9917945,"Perfect (Impulse, #2)",Ellen Hopkins,4.35,0.5719,positive
17201095,"Play with Me (With Me in Seattle, #3)",Kristen Proby,4.33,0.34,neutral
268604,"Portrait in Death (In Death, #16)",J.D. Robb,4.37,-0.8316,negative
17316075,"Second Chance Boyfriend (One Week Girlfriend, #2)",Monica  Murphy,4.06,0.25,neutral
184040,"Y: The Last Man, Vol. 4: Safeword (Y: The Last Man, #4)","Brian K. Vaughan, Pia Guerra, Goran Parlov, José Marzán Jr.",4.25,0.0,neutral
18668066,The Collector,Nora Roberts,3.92,0.0,neutral
8088,Sunshine,Robin McKinley,3.85,0.4939,neutral
64857,"D is for Deadbeat (Kinsey Millhone, #4)",Sue Grafton,3.85,0.0,neutral
10846336,Salvage the Bones,Jesmyn Ward,3.81,0.0,neutral
22611920,"The Hook Up (Game On, #1)",Kristen Callihan,4.04,0.0,neutral
14069,"Throne of Jade (Temeraire, #2)",Naomi Novik,3.89,0.0,neutral
2368,Mornings on Horseback,David McCullough,4.1,0.0,neutral
79426,"Y: The Last Man, Vol. 7: Paper Dolls (Y: The Last Man, #7)","Brian K. Vaughan, Pia Guerra, Goran Sudžuka, José Marzán Jr.",4.25,0.0,neutral
92160,London,Edward Rutherfurd,4.06,0.0,neutral
16116760,"Silence (Silence, #1)",Natasha Preston,3.93,0.0,neutral
20309175,My True Love Gave to Me: Twelve Holiday Stories,"Stephanie Perkins, Holly Black, Ally Carter, Matt de la Pena, Gayle Forman, Jenny Han, David Levithan, Kelly Link, Myra McEntire, Rainbow Rowell, Laini Taylor, Kiersten White",3.73,0.8658,positive
20509356,"Sand Omnibus (Sand, #1-5)",Hugh Howey,3.96,0.0,neutral
18616975,"Off to Be the Wizard (Magic 2.0, #1)",Scott  Meyer,3.98,0.0,neutral
659388,Nobody's Fool,Richard Russo,4.12,-0.4404,neutral
66370,Rage,"Richard Bachman, Stephen King",3.8,-0.5574,negative
28407,"Germinal (Les Rougon-Macquart, #13)","Émile Zola, Roger Pearson",4.09,0.0,neutral
13573795,"Ceaseless (Existence Trilogy, #3)",Abbi Glines,4.2,0.0,neutral
11076177,The Cat's Table,Michael Ondaatje,3.59,0.0,neutral
76740,The Demolished Man,Alfred Bester,3.99,0.0,neutral
9578590,"Lost in Time (Blue Bloods, #6)",Melissa de la Cruz,4.05,-0.3182,neutral
199786,"Ninth Key (The Mediator, #2)",Meg Cabot,4.07,0.0,neutral
693172,Twilight Eyes,Dean Koontz,3.86,0.0,neutral
25644437,"Find Her (Detective D.D. Warren, #8)",Lisa Gardner,4.12,0.0,neutral
16122034,"Frigid (Frigid, #1)","J. Lynn, Jennifer L. Armentrout",3.79,0.0,neutral
16532,Of Love and Shadows,"Isabel Allende, Margaret Sayers Peden",3.96,0.6369,positive
6202556,"The Evolution of Calpurnia Tate (Calpurnia Tate, #1)",Jacqueline Kelly,3.97,0.0,neutral
3678651,"Bad Girls Don't Die (Bad Girls Don't Die, #1)",Katie Alender,4.07,0.4199,neutral
41707,"Atlantis Found (Dirk Pitt, #15)",Clive Cussler,3.96,0.0,neutral
4070095,Asterios Polyp,David Mazzucchelli,4.19,0.0,neutral
651260,"Domes of Fire (The Tamuli, #1)",David Eddings,3.98,-0.34,neutral
138397,"The Walking Dead, Vol. 04: The Heart's Desire","Robert Kirkman, Charlie Adlard, Cliff Rathburn",4.23,-0.3818,neutral
6277410,"The Stonekeeper's Curse (Amulet, #2)",Kazu Kibuishi,4.33,-0.5423,negative
13066,Sick Puppy,Carl Hiaasen,3.88,-0.5106,negative
24818,The Days Are Just Packed: A Calvin and Hobbes Collection,Bill Watterson,4.68,0.0,neutral
3253215,"An Illustrated Life: Drawing Inspiration From The Private Sketchbooks Of Artists, Illustrators And Designers",Danny Gregory,3.72,0.5267,positive
13154933,"Odd Apocalypse (Odd Thomas, #5)",Dean Koontz,3.93,-0.3182,neutral
80369,Discipline and Punish: The Birth of the Prison,"Michel Foucault, Alan Sheridan, Thomas Mathiesen, Walter Seitter, Drago Braco Rotar",4.21,-0.7717,negative
215631,Pay It Forward,Catherine Ryan Hyde,4.15,-0.1027,neutral
40168,The Creative License: Giving Yourself Permission to Be The Artist You Truly Are,Danny Gregory,3.93,0.802,positive
569346,"Full Moon o Sagashite, Vol. 1","Arina Tanemura, Tomo Kimura",4.06,0.0,neutral
68531,"The Archer's Tale (The Grail Quest, #1)",Bernard Cornwell,4.12,0.0,neutral
12535,Plan B: Further Thoughts on Faith,Anne Lamott,4.05,0.4215,neutral
62212,In the Company of the Courtesan,Sarah Dunant,3.76,0.0,neutral
13630171,"The Skull Throne (Demon Cycle, #4)",Peter V. Brett,4.14,0.0,neutral
84133,"Devil May Cry (Dark-Hunter, #11)",Sherrilyn Kenyon,4.32,-0.8176,negative
30002998,Two By Two,Nicholas Sparks,3.9,0.0,neutral
96081,Sea Glass,Anita Shreve,3.65,0.0,neutral
248470,"River Secrets (The Books of Bayern, #3)",Shannon Hale,4.03,0.0,neutral
18404285,"Be Careful What You Wish For (The Clifton Chronicles, #4)",Jeffrey Archer,4.04,0.5106,positive
12925063,"Inescapable (The Premonition, #1)",Amy A. Bartol,4.05,0.0,neutral
6918909,"Illusions (Wings, #3)",Aprilynne Pike,4.12,0.0,neutral
333907,Fatal Vision,Joe McGinniss,4.1,-0.3612,neutral
1491906,Gang Leader for a Day: A Rogue Sociologist Takes to the Streets,Sudhir Venkatesh,4.01,0.0,neutral
43915,Magician: Apprentice  (Raymond E. Feist's Magician: Apprentice #1),"Raymond E. Feist, Michael Avon Oeming, Bryan J.L. Glass, Ryan Stegman",4.44,0.0,neutral
183554,Developing the Leader Within You,John C. Maxwell,4.18,0.0,neutral
100933,"That Hideous Strength (Space Trilogy, #3)",C.S. Lewis,3.87,0.4939,neutral
18652002,The Bees,Laline Paull,3.67,0.0,neutral
2458340,Ape House,Sara Gruen,3.46,0.0,neutral
18884,Polgara the Sorceress (Malloreon),"David Eddings, Leigh Eddings",4.07,0.0,neutral
22674105,China Rich Girlfriend (Crazy Rich Asians #2),Kevin Kwan,3.74,0.802,positive
216304,A Woman After God's Own Heart,Elizabeth George,4.29,0.0,neutral
206195,"State of the Union (Scot Harvath, #3)",Brad Thor,4.2,0.0,neutral
15793186,The Good House,Ann Leary,3.66,0.4404,neutral
14362,"Bless Me, Ultima",Rudolfo Anaya,3.74,0.4215,neutral
